TweetID,TweetURL,tweet
1514236218824749060,https://twitter.com/tvOneNews/status/1514236218824749060,Grace Natalie Seret Relawan Anies dalam Aksi Pengeroyokan Ade Armando https://t.co/AE7oYmUzdf
1514134310156046338,https://twitter.com/tvOneNews/status/1514134310156046338,"Pelaku Pemukulan Ade Armando, Polda Metro: Try Budi Purwanto Tak Terlibat https://t.co/3Ir40FiJdz"
1514110017309270016,https://twitter.com/tvOneNews/status/1514110017309270016,Menko Polhukam Mahfud Minta Polisi Tindak Tegas Penganiaya Ade Armando https://t.co/9JHYbUe9qY
1514079438601818118,https://twitter.com/tvOneNews/status/1514079438601818118,Fraksi PDIP Tidak Akan Beri Sanksi Kepada H-M Soal Nonton Video Porno https://t.co/Moa7KpAThj
1513856964039692289,https://twitter.com/tvOneNews/status/1513856964039692289,"Pemerintah menyayangkan atas terjadinya penganiayaan dan tindak kekerasan terhadap Ade Armando saat unjuk rasa di depan Gedung DPR Senayan, Jakarta, pada Senin (11/4/2022).
Simak berita selengkapnya di https://t.co/GgtZcy3DlU
#NewsOne #CariBeritaditvOne #BerkahRamadhanditvOne https://t.co/wloQN5TLgH"
1513842503052509186,https://twitter.com/tvOneNews/status/1513842503052509186,Pemerintah Sayangkan Penganiayaan Terhadap Ade Armando https://t.co/uNMJQXwW0g
1513748730675367941,https://twitter.com/tvOneNews/status/1513748730675367941,"Ade Armando dianiaya &amp; dilucuti pakainnya. Apa yang melatarbelakangi aksi ini hingga terjadi? 

Saksikan Catatan Demokrasi: “ADE ARMANDO DIANIAYA MASSA DI TENGAH DEMO” live malam ini pukul 20.00 WIB di tvOne.

#CatatanDemokrasitvOne #CariBeritaditvOne #Ftaads https://t.co/INL729JPP6"
1513739954802765825,https://twitter.com/tvOneNews/status/1513739954802765825,Ade Armando Muntah-Muntah Darah akibat Luka di Bagian Dalam Kepala setelah Dipukuli https://t.co/3CbdXwComp
1513699183273779200,https://twitter.com/tvOneNews/status/1513699183273779200,BEM UI Kecam Penganiayaan dan Pelecehan Dosen FISIP Ade Armando https://t.co/oyNVqa62Kr
1513680307890765828,https://twitter.com/tvOneNews/status/1513680307890765828,IPW Duga Aksi Pengeroyokan Ade Armando Direncanakan https://t.co/HbQMMGb6aT
1513551977208115201,https://twitter.com/tvOneNews/status/1513551977208115201,Moeldoko Kecam Tindak Kekerasan Terhadap Ade Armando https://t.co/jAaaNELfy0
1513540896351940611,https://twitter.com/tvOneNews/status/1513540896351940611,"Kemiskinan Ekstrem di Jateng Bertambah Jadi 19 Daerah, Ini Respon Ganjar https://t.co/MVTD6iyhrc"
1513515346212270085,https://twitter.com/tvOneNews/status/1513515346212270085,Kapolda Metro Jaya: Ade Armando Alami Luka Parah di Kepala https://t.co/cYuE0d93dh
1513508176871653377,https://twitter.com/tvOneNews/status/1513508176871653377,Kapolda Metro Jaya Ultimatum Pengeroyok Ade Armando Untuk Menyerahkan Diri https://t.co/guqMyf3Luo
1513481247237947397,https://twitter.com/tvOneNews/status/1513481247237947397,"Pemukul Ade Armando Ditangkap, Polisi: Sudah Beberapa Kami Amankan https://t.co/VXATvndhWm"
1513472564516982785,https://twitter.com/tvOneNews/status/1513472564516982785,Pemukul Ade Armando Akan Dibawa ke Jalur Hukum https://t.co/dV3nj5pPOi
1513453511740375042,https://twitter.com/tvOneNews/status/1513453511740375042,"Beredar sebuah foto yang memperlihatkan wajah Ade Armando terlihat babak belur, bahkan ade terlihat tak mengenakan celana.

Simak berita selengkapnya di https://t.co/GgtZcy4bbs
#NewsOne #CariBeritaditvOne #BerkahRamadhanditvOne #DemoMahasiswa https://t.co/VFZr3kXqtQ"
1513450293056339969,https://twitter.com/tvOneNews/status/1513450293056339969,Ade Armando Babak Belur di Aksi Mahasiswa https://t.co/OAFCpZ4c8l
1513368250490318853,https://twitter.com/tvOneNews/status/1513368250490318853,"Tetap Digelar 14 Februari 2024, Presiden Jokowi Bantah Penundaan Pemilu https://t.co/GABEBY2znr"
1513330260216987653,https://twitter.com/tvOneNews/status/1513330260216987653,Polisi Janji Tak Ada Peluru Tajam Dalam Pengamanan Demo Mahasiswa https://t.co/yFIERi8SDg
1513126664779157506,https://twitter.com/tvOneNews/status/1513126664779157506,Presiden Jokowi Tegaskan Pemilu dan Pilkada Serentak Dilaksanakam 14 Februari 2024 https://t.co/TKxqEViq70
1513083129191284741,https://twitter.com/tvOneNews/status/1513083129191284741,Menkominfo: Presiden Minta Tak Ada Lagi Bicara Penundaan Pemilu https://t.co/FGamaJaSZW
1512977174390661120,https://twitter.com/tvOneNews/status/1512977174390661120,"Heboh, Nonton Video Porno Saat Rapat Bahas Vaksin https://t.co/ACNjMEi8j7"
1512870347363680259,https://twitter.com/tvOneNews/status/1512870347363680259,"Antisipasi Gelombang Demo 11 April di Jakarta, Satgas Pelajar Pelajari Pergerakan Pelajar https://t.co/mvrrewAVJE"
1512832732409126913,https://twitter.com/tvOneNews/status/1512832732409126913,"Larang Pelajar Ikut Demo 11 April, Polres Metro Bekasi Kota Undang Kepala Sekolah dan Dinas Pendidikan https://t.co/WDJ1SFmBON"
1512746405235888133,https://twitter.com/tvOneNews/status/1512746405235888133,"Demo Mahasiswa 11 April, Menkopolhukam Minta Aparat Keamanan dan Penegak Hukum Tidak Melakukan Kekerasan https://t.co/sJDRUs3Aik"
1512685009940799488,https://twitter.com/tvOneNews/status/1512685009940799488,Sudah Sepekan Solar Subsidi dan Pertalite Kosong di Pangkalan Agen Pertamina Selayar https://t.co/ZtOjy2pK6V
1512676321847312389,https://twitter.com/tvOneNews/status/1512676321847312389,"Gubernur Jawa Tengah, Ganjar Pranowo, berkeliling Kota Medan ditemani Wali Kota Medan, Bobby Nasution. Ganjar mengunjungi beberapa tempat bersejarah di Medan.

Simak berita selengkapnya di https://t.co/qaEfoXASw1
#NewsOne #CariBeritaditvOne #pilpres2024 #ganjarpranowo https://t.co/Gn4UTjBauD"
1512651782219964422,https://twitter.com/tvOneNews/status/1512651782219964422,Mau Perusahaan Berkah? Menaker Ida: Beri THR Lebih dari 1 Kali Gaji https://t.co/0ZWtcSAQGy
1512606104571707394,https://twitter.com/tvOneNews/status/1512606104571707394,"Sekretariat Mahasiswa di Kendari Diserang OTK Pakai Sajam dan Airsoft Gun, 2 Mahasiswa Terluka https://t.co/2h0fbXi4wt"
1512435618193629191,https://twitter.com/tvOneNews/status/1512435618193629191,"Ricuh, Demo Mahasiswa di Semarang Tolak Kenaikan BBM dan Wacana 3 Periode https://t.co/IMNjUZEocC"
1512415504329154561,https://twitter.com/tvOneNews/status/1512415504329154561,BEM Nusantara: Pemerintah Tidak Melarang Mahasiswa Turun Aksi https://t.co/5xtHxish8D
1512372697854062595,https://twitter.com/tvOneNews/status/1512372697854062595,Wantimpres Menemui BEM Nusantara Tampung Aspirasi Penolakan Penundaan Pemilu 2024 https://t.co/8tUidVJcz8
1511936577353650177,https://twitter.com/tvOneNews/status/1511936577353650177,"Ganjar Heran, Ratusan Aduan Masuk: Semua Soal Minyak Goreng https://t.co/HHHEvJPMUD"
1511923607890399236,https://twitter.com/tvOneNews/status/1511923607890399236,"Gaji Direksi, Komisaris, dan Pegawai Pertamina Bakal Naik Bulan Ini, Berapa Besarannya? https://t.co/FpgCpXfpun"
1511914117552308224,https://twitter.com/tvOneNews/status/1511914117552308224,"Presiden Joko Widodo (Jokowi) memberikan arahan tegas kepada para pembantunya di pemerintahan untuk tidak lagi membahas penundaan pemilu maupun perpanjangan masa jabatan presiden.

Simak berita selengkapnya di https://t.co/yEbJrGNAZx
#NewsOne #CariBeritaditvOne #Pemilu #Jokowi https://t.co/8MpD33Cx9d"
1511641373631414272,https://twitter.com/tvOneNews/status/1511641373631414272,Moeldoko: Staf KSP Tidak Pernah Minta Dukungan Uang https://t.co/xs4DauziJx
1511631558951661569,https://twitter.com/tvOneNews/status/1511631558951661569,"Pertamax Melambung, Pertalite Menghilang di Sejumlah SPBU https://t.co/qTP3y7eJWE"
1511548637393739778,https://twitter.com/tvOneNews/status/1511548637393739778,Haram Mendirikan Negara Seperti di Zaman Nabi Muhammad? https://t.co/ayTBzVmAQd
1511542977428013057,https://twitter.com/tvOneNews/status/1511542977428013057,"Beli Video Dea Onlyfans, Komedian M Dicari Polisi https://t.co/6LoOrUJwer"
1511326674658373632,https://twitter.com/tvOneNews/status/1511326674658373632,Warga di Cirebon Rela Menginap Demi Mendapat Minyak Goreng Curah https://t.co/4qlE77nzMI
1511294107427098631,https://twitter.com/tvOneNews/status/1511294107427098631,PM Palestina Minta Bantuan Dunia Setop Serangan Israel https://t.co/EEOxebxbWr
1511223875840798721,https://twitter.com/tvOneNews/status/1511223875840798721,"Viral, Surat Tenaga Ahli Utama Kantor Staf Presiden Minta Sumbangan Rp 800 Juta ke Wali Kota Cirebon https://t.co/cn0FhbIgQ4"
1511214690407354371,https://twitter.com/tvOneNews/status/1511214690407354371,Memaknai Husnuzhon Dalam Kehidupan Bersama Gus Miftah https://t.co/N7MVlHwaq9
1511206765836181505,https://twitter.com/tvOneNews/status/1511206765836181505,"Jenderal Dudung Menangis Temui Anak Prajurit, Janji Biayai Pendidikan hingga Tuntas https://t.co/qOucNiGNOj"
1510966197457616898,https://twitter.com/tvOneNews/status/1510966197457616898,Presiden Jokowi Batal Shalat Tarawih di Istiqlal https://t.co/ZNJOKRf5C1
1510799700856692737,https://twitter.com/tvOneNews/status/1510799700856692737,"Dukung Panglima Andika Soal Keturunan PKI, Mahfud MD; TNI Punya Alat Tes https://t.co/iVXhcvSBBk"
1510647330264911874,https://twitter.com/tvOneNews/status/1510647330264911874,DKI Berencana Jadikan JIS Lokasi Shalat Idul Fitri 1443 Hijriah https://t.co/hXvDmtD3zF
1510568087426572289,https://twitter.com/tvOneNews/status/1510568087426572289,"Satgas penanganan Covid-19 mengeluarkan aturan terbaru tentang penerbangan, di mana penumpang pesawat kembali wajib menunjukkan hasil negatif PCR dan Antigen walau sudah vaksin 1 dan 2.
Simak berita selengkapnya di https://t.co/oUJUDMcNOF
#NewsOne #CariBeritaditvOne https://t.co/jNofywXrrq"
1510560840378126338,https://twitter.com/tvOneNews/status/1510560840378126338,"Saksikan Ustadz Abdul Somad selama Bulan Suci Ramadan di tvOne dan kanal Youtube Religi One

#BerkahRamadhanditvOne # #CariBeritaditvOne https://t.co/a3zBGudmPx"
1510528540172713984,https://twitter.com/tvOneNews/status/1510528540172713984,"Aturan Baru Penerbangan, Walau Sudah Vaksin 2 Kali Tetap Tunjukkan Surat PCR dan Antigen https://t.co/QlwPv12QMq"
1510446502409224195,https://twitter.com/tvOneNews/status/1510446502409224195,Membludak! Sholat Tarawih Pertama Di Masjid Ampel Surabaya Jamaah Tak Kenakan Masker https://t.co/lRHNM4r55r
1510264803255730178,https://twitter.com/tvOneNews/status/1510264803255730178,Masjid Agung Meulaboh Aceh Gelar Shalat Tarawih Tanpa Jarak https://t.co/SiAD61y3Ku
1510169682023641088,https://twitter.com/tvOneNews/status/1510169682023641088,"Karpet Kembali Digelar, Sholat Tarawih di Masjid Istiqlal Dilakukan dengan Shaf Rapat https://t.co/jguC1lLcBi"
1510121228941418500,https://twitter.com/tvOneNews/status/1510121228941418500,Wapres: Puasa Momentum Dekatkan Diri ke Allah &amp; Introspeksi https://t.co/GDNERp0mol
1510098060399251457,https://twitter.com/tvOneNews/status/1510098060399251457,"Menteri Agama, menerbitkan Surat Edaran Nomor SE. 08 Tahun 2022 tentang Panduan Penyelenggaraan Ibadah pada Bulan Ramadhan dan Idul Fitri yang salah satu isinya mengatur tentang materi ceramah

Simak berita selengkapnya di https://t.co/Lfa06K9fAC
#NewsOne #CariBeritaditvOne https://t.co/a58ks3YgBj"
1510087886418296835,https://twitter.com/tvOneNews/status/1510087886418296835,"Program BLT Minyak Goreng, Jokowi Berikan Bantuan Rp 300 Ribu untuk 20,5 Juta Keluarga Miskin https://t.co/DMojW8jl47"
1510073169624723456,https://twitter.com/tvOneNews/status/1510073169624723456,Menag Yaqut: Penceramah Dilarang Pertentangkan Khilafiyah saat Tausiyah Ramadhan https://t.co/CDQ8HIWjd5
1509793963091238913,https://twitter.com/tvOneNews/status/1509793963091238913,Luhut Beri Sinyal Kenaikan BBM Pertalite Hingga LPG 3 Kg https://t.co/0UQbWvFu9h
1509786672371707906,https://twitter.com/tvOneNews/status/1509786672371707906,"Harga Pertamax Naik, Erick Thohir hanya Minta Maaf https://t.co/d9si2JNHQa"
1509688507341574170,https://twitter.com/tvOneNews/status/1509688507341574170,"Ingat, Tarif PPN 11 Persen Berlaku Mulai Hari Ini https://t.co/exCpy1Sbth"
1509517277447999491,https://twitter.com/tvOneNews/status/1509517277447999491,"Kementerian Agama melarang Aparatur Sipil Negara (ASN) di lingkungan kerjanya menggelar atau menghadiri buka bersama dan Open House Idul Fitri.

Simak berita selengkapnya di https://t.co/GgtZcy4bbs
#NewsOne #CariBeritaditvOne #ASN #Bukber https://t.co/w5fexQGcjs"
1509427281181110272,https://twitter.com/tvOneNews/status/1509427281181110272,Harga Pertamax Bakal Naik Jadi Rp16.000 Per Liter Besok 1 April 2022 https://t.co/G4N7DCMcc1
1509403190047178752,https://twitter.com/tvOneNews/status/1509403190047178752,"MUI Kab. Bekasi &amp; MUI Kab. Lebak, Banten, minta restoran tutup siang hari saat ramadhan hadirkan pro kontra. Lantas, haruskah rumah makan ditutup selama ramadhan?

Tonton Dua Sisi bersama Dwi Anggia malam ini jam 20.00 WIB di tvOne.

#DuaSisitvOne #promoads #promofta #Wadimor https://t.co/NiiyPoN82R"
1509391806806441987,https://twitter.com/tvOneNews/status/1509391806806441987,Polda Papua: KKB Bakar Sekolah &amp; Aniaya Guru di Hitadipa https://t.co/dduG8vZhoq
1509367526530043911,https://twitter.com/tvOneNews/status/1509367526530043911,"[FULL] Jokowi Marah, RI Banjir Barang Impor | Indonesia Business Forum https://t.co/xCLSR33YL8"
1509347569717374976,https://twitter.com/tvOneNews/status/1509347569717374976,"Panglima TNI, Jenderal TNI Andika Perkasa, mengingatkan jajarannya bahwa keturunan anggota Partai Komunis Indonesia tidak boleh jadi alasan menggagalkan calon prajurit dalam proses seleksi.

Simak berita selengkapnya di https://t.co/43xMIu0oWF
#NewsOne #CariBeritaditvOne #TNI https://t.co/mvE2op0HkM"
1509335049845366792,https://twitter.com/tvOneNews/status/1509335049845366792,Jokowi Soal Presiden Tiga Periode: Kita Harus Taat Konstitusi https://t.co/DissNrFaUP
1509208717333463042,https://twitter.com/tvOneNews/status/1509208717333463042,Panglima: Keturunan Anggota PKI Jangan Jadi Alasan Gagalkan Calon Prajurit https://t.co/qxUIugvLKl
1509138372165439499,https://twitter.com/tvOneNews/status/1509138372165439499,"Presiden Jokowi marah besar terkait besarnya impor untuk pengadaan barang oleh kementerian/lembaga dan BUMN. Lalu mengapa impor masih tinggi? 

Simak Indonesia Business Forum bersama Brigita Manohara, malam ini jam 20.00 WIB hanya di tvOne.

#IBFtvOne #CariBeritaditvOne #PromoFta https://t.co/XdYyptNvaV"
1509065021929639936,https://twitter.com/tvOneNews/status/1509065021929639936,"Blusukan di Pasar Baledono, Presiden Jokowi Belanja Cabai dan Ikan Asin https://t.co/yfoQd4rzOw"
1509035201694879747,https://twitter.com/tvOneNews/status/1509035201694879747,Respon Masyarakat Soal Boleh Bukber Tapi Dilarang Ngobrol https://t.co/EKHzz9fs5T
1509029414054498311,https://twitter.com/tvOneNews/status/1509029414054498311,"Minta 300 Ayat Al-Quran Dihapus, Saifuddin Ibrahim jadi Tersangka https://t.co/rK7NCCmHqn"
1508771678481895428,https://twitter.com/tvOneNews/status/1508771678481895428,"Kepala Otorita Ibu Kota Nusantara (IKN), Bambang Susantono berharap masyarakat dapat urun rembuk dalam pembangunan ibu kota baru, termasuk dalam hal pembiayaan.
Simak berita selengkapnya di https://t.co/oaxxqH2hik
#NewsOne #CariBeritaditvOne #IKN https://t.co/GGsLR4zOCk"
1508740759930900484,https://twitter.com/tvOneNews/status/1508740759930900484,"Wapres: Ramadhan Jangan Konsumtif, Siapa Kelebihan Bagikan Pada yang Membutuhkan https://t.co/5M0oul6cDv"
1508720501820076036,https://twitter.com/tvOneNews/status/1508720501820076036,"Boleh Bukber Selama Ramadhan, Tapi 'Ga' Boleh Ngobrol https://t.co/l4WFCsidZu"
1508686918229594113,https://twitter.com/tvOneNews/status/1508686918229594113,Putra Presiden Jokowi Masuk 'Radar' Calon Ketum Himpunan Pengusaha Nahdliyin https://t.co/iVhOHyNbbA
1508633930794110976,https://twitter.com/tvOneNews/status/1508633930794110976,Anda Mau Diajak Saweran Bangun Ibu Kota Negara? | EcoFlash https://t.co/QGA05cj2r6
1508390707404279809,https://twitter.com/tvOneNews/status/1508390707404279809,Viral Video Polisi Pukul Polisi https://t.co/BVe0kJ4ERh
1508336960816881665,https://twitter.com/tvOneNews/status/1508336960816881665,"Ketua Umum Partai Amanat Nasional (PAN), Zulkifli Hasan, meminta jangan salahkan presiden (Jokowi), terkait upayanya bersama sejumlah partai (Golkar dan PKB) yang mendukung Jokowi tiga periode. 
Simak berita selengkapnya di https://t.co/ekZB0HKuDz
#NewsOne #CariBeritaditvOne https://t.co/7eBF2ICatg"
1508249899128991745,https://twitter.com/tvOneNews/status/1508249899128991745,"Ibu-ibu Resah Minyak Goreng Mahal, Megawati Gelar Demo Masak Tanpa Menggoreng https://t.co/kYA0liGDvc"
1508048791882321920,https://twitter.com/tvOneNews/status/1508048791882321920,"Madrasah ""Hilang"" di RUU SISDIKNAS Saksikan beritanya di Apa Kabar Indonesia Malam Bersama Putri Viola jam 18.30 WIB hanya di tvOne &amp; live streaming di http:// https://t.co/pkGSggL0i8 #AKIMalamtvOne #CariBeritaditvOne https://t.co/Cag5h4swXF"
1508002394633768969,https://twitter.com/tvOneNews/status/1508002394633768969,Jenazah Dua Marinir Korban Penembakan KKB Dievakuasi ke Timika https://t.co/r9dj7gLZMA
1507988290640695297,https://twitter.com/tvOneNews/status/1507988290640695297,"Presiden Joko Widodo mengatakan bahwa pemindahan Ibu Kota Negara (IKN) dari DKI Jakarta ke Kalimantan Timur merupakan sebuah cita-cita besar untuk mewujudkan Indonesia sentris, bukan Jawa sentris.
Simak berita selengkapnya di https://t.co/l9NaXyYhSO
#NewsOne #CariBeritaditvOne https://t.co/Gtb66Geatx"
1507859959274377216,https://twitter.com/tvOneNews/status/1507859959274377216,"Pak Ribut, Guru yang Viral di Medsos Dipanggil Dinas Pendidikan Lumajang karena Video Penjelasan Kaum Sodom ke Muridnya https://t.co/dwLwnaMRYb"
1507756901575974916,https://twitter.com/tvOneNews/status/1507756901575974916,"KKB Serang Pos Marinir, 1 Prajurit TNI Gugur https://t.co/FmzgVqQxb3"
1507650578792386564,https://twitter.com/tvOneNews/status/1507650578792386564,Dokter Terawan Dipecat dari IDI Karena Promosikan Vaksin Nusantara https://t.co/iXfdIr1KnO
1507558219459166211,https://twitter.com/tvOneNews/status/1507558219459166211,Jokowi Hadiri Konser Musik di Bali Pascapandemi Bersama Para Menteri https://t.co/IzbdkS0eOT
1507544383620468737,https://twitter.com/tvOneNews/status/1507544383620468737,"8 Orang Ditangkap setelah Tampil dengan Deddy Corbuzier, Netizen: Podcast Berkedok Intel https://t.co/PpC1nHwj3A"
1507508517237796868,https://twitter.com/tvOneNews/status/1507508517237796868,"Saat Presiden Jokowi Geram, Tentara, Polisi, Menkes, Mentan Kena Sindir Semua https://t.co/lIpfUeu7qo"
1507246164051042304,https://twitter.com/tvOneNews/status/1507246164051042304,Presiden Jokowi Jengkel Kementerian dan Daerah Banyak Beli Barang Impor: Bodoh Banget Kita! https://t.co/wCMY32hRDs
1507188538416107520,https://twitter.com/tvOneNews/status/1507188538416107520,"Dari Cabai Sampai Daging Sapi, Semua Sembako Mahal | EcoFlash https://t.co/RfvBUdvjtR"
1506857614029701125,https://twitter.com/tvOneNews/status/1506857614029701125,"Menjelang Ramadhan, Kapolri Listyo Sigit Cek Vaksinasi Imam Masjid di Kabupaten Bandung https://t.co/FIOquWZsIZ"
1506809032446648323,https://twitter.com/tvOneNews/status/1506809032446648323,"Ketatnya Prokes di Sekolah, Dua Siswa SD di Luwu Disuruh Pulang, Gara-Gara Belum Vaksin https://t.co/yDF7fjHitW"
1506601086819647495,https://twitter.com/tvOneNews/status/1506601086819647495,"Presiden Jokowi tegaskan pulang kampung pada perayaan Idul Fitri 2022 diperbolehkan, asalkan pemudik sudah mendapat dosis pertama dan kedua serta dosis booster vaksin Covid-19.

Simak berita selengkapnya di https://t.co/GgtZcy4bbs
#NewsOne #CariBeritaditvOne #AturanMudik #Jokowi https://t.co/MguvxcxXZ1"
1506592481529372681,https://twitter.com/tvOneNews/status/1506592481529372681,Presiden: Mudik Diperbolehkan Asal Sudah Divaksin Lengkap dan Booster https://t.co/cYNuJfSjCH
1506559022958186501,https://twitter.com/tvOneNews/status/1506559022958186501,Vladimir Putin Berencana Hadir di KTT G20 https://t.co/OzOi4dnWNw
1506413684456783873,https://twitter.com/tvOneNews/status/1506413684456783873,"Dinilai Tak Becus Urus Minyak Goreng, Mahasiswa di Kota Malang Demo Tuntut Mendag Lutfi Dicopot https://t.co/4YDHwaoLIH"
1506223049292480520,https://twitter.com/tvOneNews/status/1506223049292480520,Wapres: Pemerintah Buka Kemungkinan Vaksin Booster Menjadi Syarat Mudik https://t.co/TBuriFWMVf
1506167433886765061,https://twitter.com/tvOneNews/status/1506167433886765061,"Siap-Siap PPN Naik Mulai April, Sri Mulyani: Demi Fondasi Pajak Kuat https://t.co/LyVsVMVyUd"
1505911883802447874,https://twitter.com/tvOneNews/status/1505911883802447874,Megawati Minta Kader PDIP Peka Terhadap Persoalan Rakyat https://t.co/sU3xTWtgQr
1505848077101383683,https://twitter.com/tvOneNews/status/1505848077101383683,Ketua MK Anwar Usman Akan Nikahi Adik Jokowi https://t.co/lPc8qQoleB
1505780511343407108,https://twitter.com/tvOneNews/status/1505780511343407108,"Hanya 36,63 Persen Jalan Nasional di Jateng yang Kondisinya Baik https://t.co/WJ415S4rAR"
1505562581762600960,https://twitter.com/tvOneNews/status/1505562581762600960,"Penonton MotoGP Terlantar, Pulang Jalan Kaki 3 Km Sampai Area Parkir https://t.co/B05Aj3qDjE"
1505525574097244166,https://twitter.com/tvOneNews/status/1505525574097244166,Nama Baik Terdakwa Penembakan Laskar FPI Harus Direhabilitasi https://t.co/L2p7Y6W1O3
1505521259505143815,https://twitter.com/tvOneNews/status/1505521259505143815,"Pawang Hujan Selamatkan MotoGP Mandalika.
Saksikan berita selengkapnya di Kabar Utama bersama Cornelia Amy malam ini jam 20.00 WIB hanya di tvOne &amp; live streaming klik https://t.co/7Gr3a5LusQ #KabarUtamatvOne #CariBeritaditvOne https://t.co/tvE21CpQPD"
1505476743775367174,https://twitter.com/tvOneNews/status/1505476743775367174,"Dukungan untuk Jokowi di 2024 Bertambah
Saksikan beritanya di Kabar Petang bersama Agita Mahlika pukul 17.00 WIB hanya di tvOne &amp; live streaming di https://t.co/7Gr3a5KWDi #KabarPetangtvOne #CariBeritatvOne https://t.co/HjPfDdKI6c"
1505159654589960193,https://twitter.com/tvOneNews/status/1505159654589960193,"Relawan Presiden Jokowi menggelar silahturahmi di Gedung Balerame, Kabupaten Bandung, Jawa Barat, Sabtu (19/3/2022). Para relawan menegaskan masih akan terus mendukung penuh Presiden Jokowi di 2024.
Simak berita selengkapnya di https://t.co/44ps6yjw6d
#newsOne #CariBeritaditvOne https://t.co/pzTodUiv85"
1505122919952777217,https://twitter.com/tvOneNews/status/1505122919952777217,"Ditinggal SoftBank, Luhut Andalkan Investor Abu Dhabi untuk Proyek IKN https://t.co/TsOny0vjdD"
1505100784886706179,https://twitter.com/tvOneNews/status/1505100784886706179,Ribuan Relawan se-Bandung Raya Dukung Penuh Jokowi Di 2024 https://t.co/bQw7sVdbWp
1505004895325200386,https://twitter.com/tvOneNews/status/1505004895325200386,"Harga Gula Pasir Naik saat Minyak Goreng Melambung, Warga: Pak Jokowi Kami Menyerah Angkat Tangan https://t.co/3ufYAOjn3S"
1504975468885282819,https://twitter.com/tvOneNews/status/1504975468885282819,Distributor yang Menjual Stok Minyak Goreng Bersubsidi dengan Harga Terbaru Akan Dipidanakan https://t.co/eUCbyoweC2
1504857173259546630,https://twitter.com/tvOneNews/status/1504857173259546630,Mendag: Stok Minyak Goreng dan Bahan Pokok di Ritel Modern Telah Normal https://t.co/0Pr8fyYct4
1504847734355869698,https://twitter.com/tvOneNews/status/1504847734355869698,Pengamat: Indonesia Bisa Tengahi Perang Rusia-Ukraina https://t.co/zaGkmdzZhc
1504762424263471105,https://twitter.com/tvOneNews/status/1504762424263471105,"Mendag: Saya Akan Perangi Mafia Minyak Goreng, Pastikan Mereka Dipenjara! https://t.co/OhIVgn7lhI"
1504761542021029892,https://twitter.com/tvOneNews/status/1504761542021029892,Megawati: Tiap Hari Ibu-ibu Itu Apakah Hanya Menggoreng? https://t.co/aORv5ViTBo
1504684909578768386,https://twitter.com/tvOneNews/status/1504684909578768386,"2 Polisi Penembak Anggota FPI Divonis Bebas, Hakim: Karena Alasan Pembenar https://t.co/y0xN7v9Db9"
1504671452787732487,https://twitter.com/tvOneNews/status/1504671452787732487,"Nyatakan Perang Dengan Mafia Minyak Goreng, Mendag Umumkan Calon Tersangka Senin Depan https://t.co/DqWdmWFIsP"
1504642513675509761,https://twitter.com/tvOneNews/status/1504642513675509761,"Tolong Pak Jokowi, Harga Minyak Goreng di Jember Tembus Rp48 ribu https://t.co/vvuekr1bSZ"
1504387579696730112,https://twitter.com/tvOneNews/status/1504387579696730112,Jokowi Dianugerahi Bapak Otomotif Indonesia oleh Gubernur Kepri https://t.co/eE3uyvf4Al
1504373150477602817,https://twitter.com/tvOneNews/status/1504373150477602817,"Menteri Koordinator Bidang Kemaritiman dan Investasi Luhut Binsar Pandjaitan mengirim tim ke Arab Saudi untuk tindaklanjuti penjajakan investasi di proyek Ibu Kota Negara Nusantara.

Simak berita selengkapnya di https://t.co/GgtZcy4bbs
#newsOne #CariBeritaditvOne #IKN #Luhut https://t.co/FQxcKWqHlA"
1504358138509606920,https://twitter.com/tvOneNews/status/1504358138509606920,Luhut Kirim Tim ke Arab Saudi Cari Investor untuk IKN Nusantara https://t.co/f7nmE8S8ec
1504289303429455873,https://twitter.com/tvOneNews/status/1504289303429455873,"Doni Salmanan Dimiskinkan, Halo Penjara, Bye Lambo dan Ducati | Ecoflash https://t.co/98hJ2qWeam"
1504092394211340294,https://twitter.com/tvOneNews/status/1504092394211340294,Polri Mendalami Video Pria Minta Hapus 300 Ayat Al Quran https://t.co/3GntBGuibA
1504067976726663176,https://twitter.com/tvOneNews/status/1504067976726663176,"Gelaran MotoGP, Ketua MPR: Indonesia Makin Dikenal Dunia https://t.co/KRA82CwxvS"
1504051496312139780,https://twitter.com/tvOneNews/status/1504051496312139780,Kapolri Turun Langsung ke Pasar Pastikan Stok Minyak Goreng Untuk Warga Aman https://t.co/BL3PKcoPas
1504004553573773319,https://twitter.com/tvOneNews/status/1504004553573773319,"MUI Angkat Bicara, Terkait Pendeta Saifudin yang Minta 300 Ayat Al Qur'an Dihapus https://t.co/Dq0QrkFUQJ"
