TweetID,TweetURL,tweet
1558565071357239298,https://twitter.com/tvOneNews/status/1558565071357239298,"Diusung sebagai Calon Tunggal Capres 2024 oleh Gerindra, Prabowo Akui Tidak Mudah Teruskan Peninggalan Jokowi   https://t.co/PuIvP2dEiR"
1558431374607994881,https://twitter.com/tvOneNews/status/1558431374607994881,"Usai kasus dugaan pelecehan Brigadir J kepada istri Ferdy Sambo tidak terbukti, kini Lembaga Perlindungan Saksi dan Korban (LPSK) tolak berikan perlindungan ke Putri Candrawathi. 
Simak berita selengkapnya di https://t.co/J7Zam0Ff8X
#NewsOne #CariBeritaditvOne https://t.co/K75PwZ90bA"
1558424915354652672,https://twitter.com/tvOneNews/status/1558424915354652672,Prabowo Nyatakan akan Maju di Pilpres 2024 https://t.co/YpITsEPE9g
1558386899533721600,https://twitter.com/tvOneNews/status/1558386899533721600,"Sebelum Dieksekusi, Brigadir J Disuruh Jongkok dan Dijambak, Ferdy Sambo Perintahkan Bharada E: Woy Tembak https://t.co/16efTUKeuJ"
1558321207136493568,https://twitter.com/tvOneNews/status/1558321207136493568,"Senjata Makan Tuan? Irjen Ferdy Sambo Awalnya bak 'Hero' karena Lindungi Putri yang Ngaku Dilecehkan Brigadir J, Ternyata Tak Ada Pelecehan https://t.co/BBo3phUD5F"
1558318720967393280,https://twitter.com/tvOneNews/status/1558318720967393280,"Salman Rushdie (75), penulis buku ""Ayat-Ayat Setan"" yang juga dianggap sebagai penghina Nabi Muhammad SAW kini dalam keadaan kritis.

Simak berita selengkapnya di https://t.co/29mBsDFdGE
#NewsOne #CariBeritaditvOne #salmanrushdie https://t.co/6tf3u4r4Vt"
1558298057329950720,https://twitter.com/tvOneNews/status/1558298057329950720,"Ada Indikasi Laporan Pelecehan Istri Ferdy Sambo Palsu, Putri Candrawathi Terancam Pidana? https://t.co/LuQ9sdTXjq"
1558273162604793856,https://twitter.com/tvOneNews/status/1558273162604793856,"Tersulut emosi, Wali Kota Solo Gibran Rakabuming Raka Copot Masker Oknum Paspampres https://t.co/BHGE0Iow8t"
1558249739887394816,https://twitter.com/tvOneNews/status/1558249739887394816,"Brigjen Andi Rian Mulai Terpancing Emosinya, Minta Pengacara Keluarga Brigadir J, Kamaruddin Simanjuntak Tak Ngoceh di Media: Punya Bukti Bawa https://t.co/kq0NjsZENv"
1558239921457885184,https://twitter.com/tvOneNews/status/1558239921457885184,'Ejekan' Kamaruddin untuk Irjen Ferdy Sambo: Bintang Dua Macam Apa Dia? Kalau Istri Dilecehkan kok Brigadir J Tetap Disuruh Ngawal Istrinya? https://t.co/LAcMHxcEFq
1558109564586770432,https://twitter.com/tvOneNews/status/1558109564586770432,"Akhirnya Terungkap, Tak Ada Tanda-tanda Putri Candrawathi Dilecehkan Brigadir J Sang 'Pengawal Terbaik', Irjen Ferdy Sambo Makin Panik? https://t.co/fddYUlFKcp"
1558098241639460864,https://twitter.com/tvOneNews/status/1558098241639460864,"Terbukti, Brigadir J Tak Lecehkan Putri Candrawathi, Bareskrim Stop Penanganan Kasusnya https://t.co/bPeb9iZxF6"
1558047790143418369,https://twitter.com/tvOneNews/status/1558047790143418369,"Terungkap, Ferdy Sambo Rupanya Beri Amplop ke LPSK 'Itu Bukan Diduga Memang Terjadi' https://t.co/Y6B0gyhcnF"
1558032051692900352,https://twitter.com/tvOneNews/status/1558032051692900352,Kuasa Hukum: Ferdy Sambo Bersedia Bertanggung Jawab Atas Segala Perbuatan Demi Melindungi Kehormatan Keluarga https://t.co/lmAOHGZLJU
1558018730252062720,https://twitter.com/tvOneNews/status/1558018730252062720,"IPW Bongkar Kebobrokan Para Petinggi Polisi: Mulai Urusan Perempuan hingga Praktik Perlindungan Judi dan Narkoba, Ada Uang Ratusan Miliar Beredar di Bisnis Haram Ini https://t.co/pqEGdxWRzS"
1557986263277268992,https://twitter.com/tvOneNews/status/1557986263277268992,"Profil dan Biodata Ronny Berty Talapessy Pengacara Baru Bharada E, Ternyata Pengurus PDIP DKI Jakarta https://t.co/J3IGEHURkc"
1557942257260457987,https://twitter.com/tvOneNews/status/1557942257260457987,"'Dosa-dosa' yang Dituduhkan IPW dan Kamaruddin ke Irjen Ferdy Sambo Seolah Terbantah, Polisi Bilang Brigadir J Dihabisi karena Lecehkan Putri https://t.co/YAtJcw6DRA"
1557898340485935104,https://twitter.com/tvOneNews/status/1557898340485935104,"Sudah Lenyapkan Nyawa Brigadir J pun Irjen Ferdy Sambo Tetap Salahkan Brigadir J, Ngaku Emosi karena Putri Candrawathi Dilecehkan di Magelang https://t.co/UUvJD7mKPD"
1557896172798222336,https://twitter.com/tvOneNews/status/1557896172798222336,"Emosi Irjen Ferdy Sambo Memuncak Saat Putri Candrawathi Ngadu, Sambo Kerahkan Anak Buah untuk Bantu Melenyapkan Nyawa Brigadir J https://t.co/GdtZRxi3XD"
1557881092723445760,https://twitter.com/tvOneNews/status/1557881092723445760,"Ternyata Bukan Pelecehan Di Rumah Dinas, Ini yang Dilakukan Brigadir J Kepada Putri Candrawathi Sehingga Ia 'Dihabisi' Anak Buah Irjen Sambo https://t.co/RE0vQeWHxS"
1557864701513461761,https://twitter.com/tvOneNews/status/1557864701513461761,"Wow! Polisi Temukan Uang Sebesar Rp2,3 Miliar dalam Brankas Kantor Pusat Khilafatul Muslimin di Bandara Lampung https://t.co/pXgecg8Uoa"
1557715552034238464,https://twitter.com/tvOneNews/status/1557715552034238464,"Polri mengungkap motif penembakan terhadap Brigadir J. Menurut pengakuannya, Ferdy Sambo marah karena adanya perlakuan dari Brigadir J kepada istrinya Putri Candrawathi. 

Simak berita selengkapnya di https://t.co/GgtZcy4bbs
#NewsOne #CariBeritaditvOne #BreakingNews https://t.co/9bsXdzCjM9"
1557702152348307456,https://twitter.com/tvOneNews/status/1557702152348307456,"Suaminya Ditahan, Istri Brigjen Hendra Kurniawan, Seali Syah Akan Bongkar Fakta Tentang Ferdy Sambo https://t.co/mUX7HCdadf"
1557643997580894208,https://twitter.com/tvOneNews/status/1557643997580894208,"""Bu Putri Bertengkar dengan Pak Sambo, Brigadir J Adukan Perselingkuhan Pak Sambo dengan Perempuan Cantik ke Bu Putri"" Kata Kamaruddin https://t.co/kXnmRBJZlX"
1557630625578127361,https://twitter.com/tvOneNews/status/1557630625578127361,"Banyak netizen yang mengaitkan Ferdy Sambo dengan peristiwa KM 50 di Tol Jakarta-Cikampek yang menewaskan sebanyak enam orang laskar FPI beberapa waktu lalu. 

Simak berita selengkapnya di https://t.co/GgtZcy4bbs
#NewsOne #CariBeritaditvOne #BrigadirJ https://t.co/slZSJYalOS"
1557629421967720448,https://twitter.com/tvOneNews/status/1557629421967720448,Ferdy Sambo Batal Diperiksa Komnas HAM https://t.co/7rKzerxx46
1557567537386180608,https://twitter.com/tvOneNews/status/1557567537386180608,"""Konferensi Pers Polisi soal Kematian Brigadir J Isinya Bohong Semua, Ini Balasan Allah SWT atas Kasus KM 50"" Kata Habib Bahar bin Smith https://t.co/8UZWJgylax"
1557534400681611264,https://twitter.com/tvOneNews/status/1557534400681611264,"Tagar #DariDuren3KeKM50 Trending di Twitter, Ini Kaitan Irjen Ferdy Sambo dengan Peristiwa di KM 50 Tol Japek https://t.co/Nx1AtFcPtD"
1557367724929495041,https://twitter.com/tvOneNews/status/1557367724929495041,"Tak Main-main! PSI Bidik 10,6 Juta Suara di Pemilu 2024, Giring Ganesha: Kita Jauh Lebih Solid https://t.co/K7MAQpE1Mj"
1557263776327446528,https://twitter.com/tvOneNews/status/1557263776327446528,"Padahal Irjen Ferdy Sambo Kariernya di Kepolisian Moncer, Atasan Brigadir J itu Bukan Orang Sembarangan, tapi kok Pilih ""Nyungsep ke Jurang""? https://t.co/gGvdhcuZQk"
1557155298766336000,https://twitter.com/tvOneNews/status/1557155298766336000,"""Bu Putri Candrawathi itu Terawat di Salon, Cantik, Penampilannya Cetar, yang Nangis Kemarin Hitam Gitu, Beda"" Kata Kamaruddin Simanjuntak https://t.co/K3tbrEHdGh"
1557025958472740864,https://twitter.com/tvOneNews/status/1557025958472740864,"Ferdy Sambo Jadi Tersangka, Mahfud Md: Ibarat Operasi Caesar, Kapolri Berhasil Keluarkan Bayinya https://t.co/w6k4s0tJX6"
1557021790324416517,https://twitter.com/tvOneNews/status/1557021790324416517,"Ferdy Sambo Jadi Tersangka, Kuasa Hukum Putri Candrawathi: Jangan Lupa Kasus Pelecehan Seksual https://t.co/9W6jspTWvQ"
1556990462325493760,https://twitter.com/tvOneNews/status/1556990462325493760,Irjen Ferdy Sambo Terancam Hukuman Mati https://t.co/UCZ0kXqtxN
1556974347109015552,https://twitter.com/tvOneNews/status/1556974347109015552,BREAKING NEWS: 31 Aparat Polri Ikut Terseret Kasus Pembunuhan Brigadir J https://t.co/7CUA5Tnh2I
1556972345331290112,https://twitter.com/tvOneNews/status/1556972345331290112,BREAKING NEWS: Resmi! Ferdy Sambo Tersangka Penembakan Brigadir J https://t.co/VsyeJDg356
1556853698625605638,https://twitter.com/tvOneNews/status/1556853698625605638,"""Bu Putri Candrawathi kan Cantik, Cetar, Terawat di Salon, yang Nangis Kemarin itu Kok Hitam dan Tak Terawat,"" Kata Kamaruddin Simanjuntak https://t.co/643PYwsNBo"
1556823127472029696,https://twitter.com/tvOneNews/status/1556823127472029696,"Mahfud MD: Kasus Mutilasi Ryan Jombang Saja Tuntas, Kasus Brigadir J Juga Pasti Tuntas https://t.co/ZLIXRasoNc"
1556576977359736833,https://twitter.com/tvOneNews/status/1556576977359736833,"Skenario Kasus Pembunuhan Brigadir J Mulai Terungkap, Mahfud MD: Ini Berkat Media https://t.co/a07sjBoyZl"
1556493808400928768,https://twitter.com/tvOneNews/status/1556493808400928768,"Tarif Rp 3 Jutaan Masuk Pulau Komodo Resmi Ditunda, Baru Berlaku Mulai 2023 https://t.co/iVXslHZimv"
1556485637947006977,https://twitter.com/tvOneNews/status/1556485637947006977,"Lho, Ternyata Brigadir RR Itu Ajudan ´Senior´ Putri Candrawathi, Tapi Ngakunya Ketakutan Ngumpet di Balik Kulkas Saat Insiden Brigadir J di Rumah Ferdy Sambo https://t.co/livtfrI56F"
1556460188563120128,https://twitter.com/tvOneNews/status/1556460188563120128,"Komunitas Jokowi Prabowo (Jokpro) meminta masyarakat mendukung Presiden Joko Widodo alias Jokowi menjabat tiga periode dan berpasangan dengan Menteri Pertahanan Prabowo Subianto di Pilpres 2024.

Simak berita selengkapnya di https://t.co/CUTLHEAHFs
#NewsOne #CariBeritaditvOne https://t.co/ECoy2sz8fb"
1556459951706365952,https://twitter.com/tvOneNews/status/1556459951706365952,"Bharada E Ngaku ´Tekanan Batin´ Akhirnya Ungkap Pelaku Baru Kasus Brigadir J, Si Brigadir RR Ajudan Istri Irjen Ferdy Sambo, Putri Candrawathi https://t.co/DLiA5djNjj"
1556426726497853440,https://twitter.com/tvOneNews/status/1556426726497853440,"Terungkap, Insiden Adu Tembak Bharada E dan Brigadir J Hanya Rekayasa https://t.co/42Dxuqe2nF"
1556322561390047234,https://twitter.com/tvOneNews/status/1556322561390047234,"Pengacara Keluarga Birgadir J Tagih Komitmen Kapolri: Kalau Ekor Tidak Bisa Diselesaikan, Maka Kepalanya Dipotong https://t.co/jAEHTZnc9x"
1556303686665572353,https://twitter.com/tvOneNews/status/1556303686665572353,"Terbongkar, Bharada E Akhirnya Mengakui Kebohongannya, Ternyata Bukan Adu Tembak dengan Brigadir J, Tapi... https://t.co/u6gw3cz2l9"
1556286570117812224,https://twitter.com/tvOneNews/status/1556286570117812224,"Bharada E Ngaku Diperintah Atasan Bunuh Brigadir J, Pelakunya Lebih dari Satu Orang https://t.co/Clb8iQN88L"
1556183914514853888,https://twitter.com/tvOneNews/status/1556183914514853888,"Lho, Pesulap Merah Janji Tutup Kanal Youtube Jika Dukun Benar, Kini Dia Blak-Blakan Ngaku Percaya Ghaib, Apa Bedanya? https://t.co/og4VimR8wY"
1556179850079059968,https://twitter.com/tvOneNews/status/1556179850079059968,"Didukung Relawan Jadi Calon Presiden 2024, Muhaimin Iskandar Janji Ubah Nasib Rakyat dan Bangsa https://t.co/3tiaHEOySf"
1556074284128223232,https://twitter.com/tvOneNews/status/1556074284128223232,"Penetapan Irjen Pol Ferdy Sambo Belum Tersangka, Polisi Sebut Tidak Adanya Penetapan Hanya Diminta Keterangan Kode Etik https://t.co/19EkmqNg7o"
1556002062348873728,https://twitter.com/tvOneNews/status/1556002062348873728,"Gemetar Ketakutan Di ´Seret´ ke Mako Brimob, Irjen Ferdy Sambo ´Pasrah´ Ketahuan Soal Ini Terkait Kematian Brigadir J… https://t.co/0d7qPCSF0n"
1555934253652664320,https://twitter.com/tvOneNews/status/1555934253652664320,Irjen Ferdy Sambo Ditangkap Sabtu Malam https://t.co/9DTB5JK5LF
1555911330602708992,https://twitter.com/tvOneNews/status/1555911330602708992,"Jokpro Minta Rakyat Demo MPR untuk Tuntut Jokowi Presiden Tiga Periode sampai 2029, Alasannya Yakin Pilpres 2024 Aman https://t.co/3X9XTMb9H0"
1555766763484090369,https://twitter.com/tvOneNews/status/1555766763484090369,"Jokpro Dukung Jokowi 3 Periode, Bersama Prabowo Maju di Pilpres 2024 https://t.co/lknT33tWh2"
1555529821358153731,https://twitter.com/tvOneNews/status/1555529821358153731,"Ditetapkan Jadi Tersangka Penembakan Brigadir J, Bharada E Mengaku Belum Pernah Menembak Orang https://t.co/PwSSa8jFVi"
1554981846391218176,https://twitter.com/tvOneNews/status/1554981846391218176,"Usai Ditetapkan jadi Tersangka Baku Tembak yang Tewaskan Brigadir J, Bharada E Terancam Hukuman 15 Tahun Penjara https://t.co/17xq23OXW6"
1554438383778140161,https://twitter.com/tvOneNews/status/1554438383778140161,"Bansos Beras Presiden Dikubur di Depok, Mensos Risma: Barangnya Kehujanan https://t.co/0Y4m21AumQ"
1554341741628493824,https://twitter.com/tvOneNews/status/1554341741628493824,Oknum Pendeta dan Anaknya Ditangkap Karena Memperkosa Gadis 16 Tahun https://t.co/5JRDfn5lG4
1554090594384764929,https://twitter.com/tvOneNews/status/1554090594384764929,"Diduga Jadi Korban Pelecehan Seksual, Istri Ferdy Sambo Masih Belum Bisa Ditemui, Psikolog: Kondisi Masih Syok https://t.co/wbiRiJBHq1"
1554036979473338368,https://twitter.com/tvOneNews/status/1554036979473338368,Dua Nelayan Penemu Tas Berisi 20 Kg Sabu Tak Bertuan Jadi Tersangka https://t.co/7W5xdoIzOS
1553642644739305472,https://twitter.com/tvOneNews/status/1553642644739305472,"Aplikasi Judi Online Diduga Terdaftar di PSE, Kominfo: itu Hanya Permainan  https://t.co/0AarrF3mnJ"
1553321012862668800,https://twitter.com/tvOneNews/status/1553321012862668800,Brigadir J Disebut Pernah Ketahuan Pakai Parfum Istri Ferdy Sambo hingga Acungkan Pistol ke Foto Kadiv Propam https://t.co/6IkmMQaZoO
1553238594583552000,https://twitter.com/tvOneNews/status/1553238594583552000,"Sisi Lain Brigadir J Dibongkar Pengacara Keluarga Irjen Ferdy Sambo, Sebut Brigadir J Diduga Pernah Todongkan Senjata Api ke Arah Foto Irjen Ferdy Sambo https://t.co/8DS7lbpzHX"
1552642806790754306,https://twitter.com/tvOneNews/status/1552642806790754306,"Jadi Tersangka dan Wajib Lapor, Nikita Mirzani Malah Terbang ke Luar Negeri https://t.co/3d06jrjKDu"
1552443719558696960,https://twitter.com/tvOneNews/status/1552443719558696960,"Wakil Presiden RI Ma'ruf Amin menekankan Majelis Ulama Indonesia (MUI) agar tidak terlibat soal pencapresan pada 2024 melainkan hanya memberikan pedoman kepada umat untuk memilih calon terbaik. 

Simak berita selengkapnya di https://t.co/pfag2yRi3h
#NewsOne #CariBeritaditvOne https://t.co/vH14yj9S30"
1551739349338796033,https://twitter.com/tvOneNews/status/1551739349338796033,Ganjar Pranowo Coba Motor Listrik Inovasi Pelajar SMKN 2 Bawang Banjarnegara https://t.co/oClgF2RNQC
1551505048324124673,https://twitter.com/tvOneNews/status/1551505048324124673,BREAKING NEWS! Komnas HAM akan Beberkan Semua Catatan Penting Brigadir J https://t.co/zl9lAw7BJ0
1551436845598142464,https://twitter.com/tvOneNews/status/1551436845598142464,Densus 88 Sita Belasan Senjata Api Saat Penangkapan Terduga Teroris Jamaah Islamiyah dan JAD di Sumatera https://t.co/bYx77uRkbb
1551178150796673024,https://twitter.com/tvOneNews/status/1551178150796673024,Nikita Mirzani Sebut Upaya Paksa Penangkapan yang Dilakukan oleh Pihak Kepolisian Membuat Anaknya Trauma https://t.co/ao3OrLxos4
1551143158238416896,https://twitter.com/tvOneNews/status/1551143158238416896,"Baim Wong dan Indigo Rebutan Hak Intelektual Citayam Fashion Week, Sama-sama Daftar ke Dirjen HAKI https://t.co/JNIXGkcgc0"
1551091456655257600,https://twitter.com/tvOneNews/status/1551091456655257600,"Bahaya! Media Sosial Membuat Opini Publik Terhadap Kasus Brigadir J, Petrus: Irjen Ferdy Digiring sebagai Pelaku https://t.co/94pycoDsMi"
1551030292839669760,https://twitter.com/tvOneNews/status/1551030292839669760,"Perilaku LGBT di ""Citayam Fashion Week"", Wagub DKI: Jangan Sampai Nanti Ada LGBT Ya... https://t.co/oJeRauhWlK"
1550969899052240896,https://twitter.com/tvOneNews/status/1550969899052240896,"Soal Strategi Pemenangan Cak Imin, PKB Sebut Strategi Pemilu 2024 Pemilih Sebagai Raja dan Partai Adalah Pelayan https://t.co/JKPnuiNV5k"
1549998896482381826,https://twitter.com/tvOneNews/status/1549998896482381826,"Segera Terungkap! Jantung Irjen Ferdy Sambo Dag Dig Dug, Rekaman CCTV Brigadir J Sebelum Tewas Sudah Diproses Penyelidikan https://t.co/v0iTmkYkx4"
1549981718131929088,https://twitter.com/tvOneNews/status/1549981718131929088,"Dalam cuitan di akun Twitter-nya, Denny Siregar menyindir Habib Rizieq Shihab yang baru bebas dari penjara. Di cuitan itu, Denny Siregar menyindir soal Habib Rizieq Shihab.

Simak berita selengkapnya di https://t.co/5RDuShouAG
#NewsOne #CariBeritaditvOne https://t.co/lda2AyeH0p"
1549955458756005889,https://twitter.com/tvOneNews/status/1549955458756005889,"Habib Rizieq Shihab Bebas, Denny Siregar Nyinyir, Denny Tiba-tiba Singgung Soal Pentingnya Banyak Istri, Apa Maksudnya ya? https://t.co/XXFWtHX9aH"
1549923273751683074,https://twitter.com/tvOneNews/status/1549923273751683074,"Drama 'Kematian Sang Ajudan' Segera Terungkap, CCTV Berisi Cuplikan Brigadir J Sebelum Tewas Ditemukan, Irjen Ferdy Sambo Mulai Deg-degan? https://t.co/8sRsASOJaY"
1549780811540443136,https://twitter.com/tvOneNews/status/1549780811540443136,"Kemarin Rusak Disambar Petir, Kini Polri Temukan CCTV di Rumah Irjen Ferdy Sambo https://t.co/m8NXUElJzo"
1549763852278960128,https://twitter.com/tvOneNews/status/1549763852278960128,Resmi! Kapolri Nonaktifkan Karo Paminal Brigjen Hendra Kurniawan dan Kapolres Jakarta Selatan Kombes Budhi Herdi Susianto Buntut Kasus Penembakan Brigadir J https://t.co/waZWQlJ3GG
1549002073705836544,https://twitter.com/tvOneNews/status/1549002073705836544,Kapolri Nonaktifkan Ferdy Sambo Dari Jabatan Kadiv Propam Polri https://t.co/apX5YY8R39
1549002066646798336,https://twitter.com/tvOneNews/status/1549002066646798336,Alasan Kadiv Propam Irjen Ferdy Sambo Dinonaktifkan Kapolri Listyo Sigit: Agar Peristiwa Terang Benderang! https://t.co/QBTnaVK6RW
1548629469656600576,https://twitter.com/tvOneNews/status/1548629469656600576,"Komnas HAM Mulai Bergerak soal Tewasnya Brigadir J, Semua Pihak Akan Dipanggil https://t.co/enGkge8NzQ"
1548617021989916672,https://twitter.com/tvOneNews/status/1548617021989916672,"Hindari Spekulasi di Kasus Brigadir J, Polri: Kita Terus Perkuat Pembuktian Ilmiah https://t.co/GAUJlKwKVR"
1548564173503639552,https://twitter.com/tvOneNews/status/1548564173503639552,"Saksi Baku Tembak Polisi di Rumah Ferdy Sambo Segera Terungkap, Irjen Dedi: Mohon Bersabar https://t.co/utrmtV0vH2"
1548491056538210307,https://twitter.com/tvOneNews/status/1548491056538210307,Polri Janji Bakal Tindak Tegas Anggota Yang Intimidasi Wartawan https://t.co/UGF3jLVsCd
1548360826586705920,https://twitter.com/tvOneNews/status/1548360826586705920,Oknum Polisi Diduga Cabuli 4 Orang Anak Dibawah Umur https://t.co/aD3y6HfnWw
1548279317884416001,https://twitter.com/tvOneNews/status/1548279317884416001,Komnas Perempuan Meminta untuk Hentikan Publikasi Berisi Spekulasi Terkait Kasus Penembakan di Rumah Irjen Ferdy Sambo https://t.co/PiLgnqd5US
1548198709459947528,https://twitter.com/tvOneNews/status/1548198709459947528,"Sebanyak sembilan warga sipil dilaporkan meninggal akibat ditembak dan dianiaya Kelompok Kriminal Bersenjata (KKB) di Nogolaid, Kabupaten Nduga, Papua.  
Simak berita selengkapnya di https://t.co/cgQLRyO0d4
#NewsOne #CariBeritaditvOne https://t.co/jwgTUhxSdk"
1548184536357298177,https://twitter.com/tvOneNews/status/1548184536357298177,"KKB Tembak 10 Warga Sipil di Nduga, 9 Dilaporkan Meninggal https://t.co/6aqzjLSZA2"
1548095838936653826,https://twitter.com/tvOneNews/status/1548095838936653826,"Momen Jenderal Soedirman Membuat Belanda Geram: Kelakuannya yang Seperti Raja, Menjengkelkan! https://t.co/2xdisntiYd"
1548081991718821888,https://twitter.com/tvOneNews/status/1548081991718821888,"Dianggap Perhatian Terhadap Kesulitan Masyarakat, Tingkat Kepuasan Kepada Presiden Jokowi Meningkat https://t.co/8aOHSliP2d"
1547856632180133888,https://twitter.com/tvOneNews/status/1547856632180133888,Polres Serang Kota Tetapkan Nikita Mirzani sebagai Tersangka https://t.co/WEFTeYm91O
1547688410042621952,https://twitter.com/tvOneNews/status/1547688410042621952,"Polisi Akui Ganti Decoder CCTV Pos Satpam di Kompleks Perumahan Kadiv Propam, Tepat Sehari Setelah Insiden Baku Tembak Brigadir J dan Bharada E https://t.co/ZBKiCCzqS9"
1547476282794881024,https://twitter.com/tvOneNews/status/1547476282794881024,Komplotan Copet Suporter Arema Dibekuk Polrestabes Semarang https://t.co/s1BgwUW6xM
1547416916427304960,https://twitter.com/tvOneNews/status/1547416916427304960,"Keluarga Heran! Tak Hanya CCTV yang Rusak, 3 HP milik Brigadir J Dilaporkan Hilang Setelah Insiden Baku Tembak, Nomor Whatsapp Keluarga Juga Diretas https://t.co/n5MRRZ212O"
1547416888761729025,https://twitter.com/tvOneNews/status/1547416888761729025,"Susno Duadji Dulu Berpenampilan Gagah Pakai Seragam Polisi, Kini Pakai Kaus dan Sandal Jepit Jadi Petani di Kampung Halaman https://t.co/cF1zYMijF1"
1547401257895112705,https://twitter.com/tvOneNews/status/1547401257895112705,Puan Maharani Bakal Dapat Gelar Doktor Honoris Causa dari Universitas Nasional Pukyong https://t.co/XGdgZAYETG
1547251046652596224,https://twitter.com/tvOneNews/status/1547251046652596224,"Teka-teki Polisi Tembak Polisi di Rumah Kadiv Propam Irjen Ferdy Sambo, Ketua RT Tak Lihat Ambulans Evakuasi Jenazah Brigadir J: Nggak Tahu Diangkut Pakai Apa https://t.co/vWerx5WKWj"
1547192381585231872,https://twitter.com/tvOneNews/status/1547192381585231872,"Ketua RT Bersaksi Decorder CCTV Diganti oleh Petugas Tak Berseragam, Mahfud MD: Banyak Kejanggalan di Kematian Brigadir J, Kredibilitas Polri dan Pemerintah jadi Taruhan https://t.co/VigsAG1kYH"
1547163329851822082,https://twitter.com/tvOneNews/status/1547163329851822082,Ketua RT Ungkap Petugas Tanpa Seragam Ganti Decoder CCTV di Pos Satpam Sehari Setelah Insiden Polisi Tembak Polisi https://t.co/FGPYPxkKvv
1547073871265746945,https://twitter.com/tvOneNews/status/1547073871265746945,"""Bangkit Kau Anakku, Biar Terungkap Kasus Ini"", Teriakan Putus Asa Ibu Brigadir J di Makam Putranya https://t.co/lANh1sBSwd"
1547039158127828992,https://twitter.com/tvOneNews/status/1547039158127828992,"Seluruh CCTV di Rumah Kadiv Propam Mati 2 Minggu Sebelum Tragedi Penembakan Brigadir J, Polisi: Decodernya Rusak https://t.co/b5K7rnDJ1o"
1547013712120127489,https://twitter.com/tvOneNews/status/1547013712120127489,"Soekarno Mohon-mohon ke Haji Sanusi Ingin Menikahi Inggit Garnasih, Suami Inggit itu Pasrah, Membiarkan Istrinya Dinikahi Soekarno https://t.co/B8r09fmvhY"
1546985266824372224,https://twitter.com/tvOneNews/status/1546985266824372224,"Terkuak, Ternyata Putri Candrawathi Istri Kadiv Propam Sudah Laporkan Brigadir J Atas Tuduhan Tindak Pencabulan https://t.co/fLY7KWAFSE"
1546902734179164160,https://twitter.com/tvOneNews/status/1546902734179164160,Kapolri Jamin Kasus Polisi Tembak Polisi Diusut Secara Objektif dan Transparan: Pakai 'Scientific Crime Investigation' https://t.co/jDES5xXbq8
1546782937181331456,https://twitter.com/tvOneNews/status/1546782937181331456,"Pesona Istri Irjen Ferdy Sambo Membuat Brigadir J Gelap Mata, Brigadir J Nekat Berbuat Hal Tak Senonoh pada Istri Kadiv Propam itu https://t.co/Q9Jo3K7vrf"
1546708447558660096,https://twitter.com/tvOneNews/status/1546708447558660096,Keanehan dalam Kronologi Baku Tembak Brigadir J dan Bharada E Versi IPW https://t.co/iihVq924sx
1546340271670960128,https://twitter.com/tvOneNews/status/1546340271670960128,"Heboh! Indonesia Belum Bayar Sisa Pembayaran Program Pesawat Tempur KF21, Korsel Ancam Tak Akan Beri Prototipe https://t.co/8LNDjNTw4c"
1546126480219860993,https://twitter.com/tvOneNews/status/1546126480219860993,Penampakan Panitia Kurban Pakai Kaos Bergambar Wajah Anies di Masjid Riau https://t.co/5fdV2B7zFP
1546055142419550209,https://twitter.com/tvOneNews/status/1546055142419550209,"Tidak Boleh Pinjam Sirkuit Formula E Jakarta, Kapolda Fadil: Ini Bukan Soal Balapan Semata https://t.co/mknxFbZuPf"
1546052995967660032,https://twitter.com/tvOneNews/status/1546052995967660032,"Viral Stut Motor Ditilang Rp 250 Ribu, Polda Metro Jaya: Masyarakat Sedang Kesulitan Justru Harus Ditolong Bukan Ditilang https://t.co/JewD6CZvNe"
1545985428846571521,https://twitter.com/tvOneNews/status/1545985428846571521,"Bisnis Rokok Sehat Tentrem Diduga Milik Mas Bechi DPO Pencabulan, Para Santriwatinya Disuruh Merokok Demi Menaikkan Omzet https://t.co/gkiZrPvA8H"
1545848533940441088,https://twitter.com/tvOneNews/status/1545848533940441088,Rencana Konser Langit Ust Hanan Attaki Di Gresik Menuai Protes Dianggap Ceramah kontroversi https://t.co/vOU9FbGZCB
1545603654035595264,https://twitter.com/tvOneNews/status/1545603654035595264,"Mochamad Subchi Azal Tsani alias mas Bechi, anak kiai ternama di Jombang, telah ditetapkan sebagai tersangka kasus pencabulan terhadap santriwati di Pondok Pesantren Majma´al Bahrain Shiddiqiyah.

Simak berita selengkapnya di https://t.co/l5h4APROoi
#NewsOne #CariBeritaditvOne https://t.co/hTZ7yr5MHV"
1545266992885936129,https://twitter.com/tvOneNews/status/1545266992885936129,"Tagar #TangkapAbuJanda kian ramai di Twitter pada Kamis (7/7/2022) malam. Tagar ini menjadi trending tropic setelah Abu Janda mengunggah pidato Gubernur DKI Anies Baswedan Soal ACT.

Simak berita selengkapnya di https://t.co/GgtZcy4bbs
#NewsOne #CariBeritaditvOne #AbuJanda https://t.co/Kqt6DuP3dG"
1545152445877067776,https://twitter.com/tvOneNews/status/1545152445877067776,Tagar Tangkap Abu Janda jadi Trending Topic di Twitter Usai Unggah Video Editan Pidato Anies Baswedan Soal ACT https://t.co/yiFvD6cJx7
1544944192614309889,https://twitter.com/tvOneNews/status/1544944192614309889,"Ngumpet Dari Publik 2,5 Tahun, Chen EXO Muncul di Bandara untuk Hallyu Pop Fest London https://t.co/KQ4uYMplGu"
