TweetID,TweetURL,tweet
1579321097883115520,https://twitter.com/tvOneNews/status/1579321097883115520,Banjir di Cilacap Tahun Ini Menjadi yang Terparah dari Beberapa Tahun Terakhir https://t.co/MsA5plmm9p
1579158398662500353,https://twitter.com/tvOneNews/status/1579158398662500353,"Anies Baswedan Pamit: Tugas untuk Pemprov DKI Usai, Tapi Tidak untuk Jakarta-Indonesia https://t.co/1H7O4HdDMu"
1579031430558257153,https://twitter.com/tvOneNews/status/1579031430558257153,"Ini Hasil Sementara Investigasi TGIPF Tragedi Kanjuruhan, Stadion Tak Layak! https://t.co/OptNWNncLr"
1579017858423881729,https://twitter.com/tvOneNews/status/1579017858423881729,"Umroh Sesuka Hati Karena Punya Banyak Duit, Lesti Kejora Dinilai Bukan Istri yang Baik: Dimana Harga Diri Suami? https://t.co/bwsfTYE5wy"
1578942352504545280,https://twitter.com/tvOneNews/status/1578942352504545280,"Berbeda dengan Laporan Polri, Media Asing Sebut Ada 40 Tembakan Gas Air Mata Saat Tragedi Kanjuruhan https://t.co/WAyF6FDmul"
1578910658099564544,https://twitter.com/tvOneNews/status/1578910658099564544,Kala Megawati dan Jokowi Dua Jam Bahas Ancaman Krisis Ekonomi https://t.co/HaCSdjPGMS
1578896662780874752,https://twitter.com/tvOneNews/status/1578896662780874752,Komisi X DPR RI Menilai SIkap PSSI Seperti Merasa Tak Bersalah Sikapi Tragedi Kanjuruhan https://t.co/d3Wq0dEtjM
1578771595824594945,https://twitter.com/tvOneNews/status/1578771595824594945,Airlangga Sebut Golkar dan PDIP Berkomitmen Sejahterakan Rakyat https://t.co/9MqbjwaA6x
1578658479166091264,https://twitter.com/tvOneNews/status/1578658479166091264,"Mencengangkan! Ternyata Polisi Hapus Paksa Bukti Video Suporter Arema di Tragedi Kanjuruhan, Begini Kata LPSK… https://t.co/WadZaEXRV2"
1578641104001695744,https://twitter.com/tvOneNews/status/1578641104001695744,"Pelantun 'Ojo Dibandingke' di Istana Negara Disuruh Mengaji, Ternyata Gus Miftah Tak Tahu Agama Farel https://t.co/VEyiqgImw3"
1578461955043766273,https://twitter.com/tvOneNews/status/1578461955043766273,Presiden FIFA Gianni Infantino akan Berkantor di Indonesia Buntut Tragedi Kanjuruhan https://t.co/Whb6qGWhTo
1578446392317865985,https://twitter.com/tvOneNews/status/1578446392317865985,Anies Baswedan Dinobatkan Sebagai Bapak Integrasi Transportasi Jakarta oleh Dishub DKI https://t.co/ZK6LFKyYI3
1578370617736585217,https://twitter.com/tvOneNews/status/1578370617736585217,"Dukung KPK Tuntaskan Kasus Formula E, Satgas Pemburu Koruptor: Jangan Terpengaruh Jargon Kriminalisasi https://t.co/M7RRYpyBlZ"
1578355256140136449,https://twitter.com/tvOneNews/status/1578355256140136449,LPSK Nilai Pihak Kepolisian Tidak Profesional karena Hapus Bukti Video Tragedi Di Stadion Kanjuruhan https://t.co/wxSr1L1e5O
1578340391379927040,https://twitter.com/tvOneNews/status/1578340391379927040,Polri Bantah Hasil Investigasi Media Asing Soal Ada 40 Tembakan Gas Air Mata https://t.co/GQvWJezPvV
1577962931366817792,https://twitter.com/tvOneNews/status/1577962931366817792,"Pengamat: Tragedi Kanjuruhan Bukan Kesalahan Satu Pihak, Apalagi Polisi https://t.co/LIKlatygXy"
1577947545950879744,https://twitter.com/tvOneNews/status/1577947545950879744,13 Ribu Orang Setuju Iwan Bule Mundur dari Ketum PSSI https://t.co/yg212wiYh9
1577938494990811137,https://twitter.com/tvOneNews/status/1577938494990811137,"PSI Deklarasi Ganjar, Untuk Apa? https://t.co/ysCcxeSZ8I"
1577901467465310208,https://twitter.com/tvOneNews/status/1577901467465310208,"Gubernur DKI Jakarta Anies Baswedan dinilai tidak becus dalam mengendalikan banjir dan kemacetan di ibu kota selama menjabat lima tahun sebagai kepala daerah. 

Simak berita selengkapnya di https://t.co/GgtZcy3DlU
#NewsOne #CariBeritaditvOne https://t.co/dNFTigQoKz"
1577888299171328001,https://twitter.com/tvOneNews/status/1577888299171328001,PSI Nilai Anies Baswedan Tidak Becus Kendalikan Banjir dan Kemacetan di DKI Jakarta https://t.co/lJk0VvpU1I
1577705727174795265,https://twitter.com/tvOneNews/status/1577705727174795265,"Hasil Kroscek Komnas HAM ke Aremania, Suporter Masuk Hanya Sekedar Peluk Pemain Arema FC https://t.co/0JeN68DPpt"
1577616409525620738,https://twitter.com/tvOneNews/status/1577616409525620738,NasDem ke Kader: Yang Tidak Setuju Anies Silakan Keluar! https://t.co/rPz9wbJ0Kb
1577614861236047873,https://twitter.com/tvOneNews/status/1577614861236047873,"Jokowi mengaku telepon Presiden FIFA, Gianni Infantino pada hari Senin (3/10/2022) malam hari. 

Simak berita selengkapnya di https://t.co/GgtZcy4bbs
#NewsOne #CariBeritaditvOne https://t.co/b4rXp5KFap"
1577600805829767168,https://twitter.com/tvOneNews/status/1577600805829767168,Presiden Jokowi Perintahkan Men PUPR Audit Seluruh Stadion Sepak Bola di Indonesia https://t.co/ucQqb4y0NT
1577600764134174720,https://twitter.com/tvOneNews/status/1577600764134174720,Fraksi PSI DPRD DKI Jakarta Menilai Anies Baswedan Belum Pantas Maju Sebagai Capres 2024 https://t.co/4DpHx7QqmU
1577596436841398272,https://twitter.com/tvOneNews/status/1577596436841398272,"Ketua Umum PSSI, Mochamad Iriawan (Iwan Bule), menolak mundur dari posisinya karena ingin bertanggung jawab dalam insiden berdarah yang terjadi di Kanjuruhan. 

Simak berita selengkapnya di https://t.co/GgtZcy4bbs
#NewsOne #CariBeritaditvOne #IwanBule https://t.co/zc6uA5AWEe"
1577573333365051392,https://twitter.com/tvOneNews/status/1577573333365051392,"Tolak Mundur dari Ketum PSSI, Iwan Bule: Salam Buat Netizen Ya https://t.co/0C5fePaS40"
1577529910440386560,https://twitter.com/tvOneNews/status/1577529910440386560,"Banjir Melanda Jakarta, Anies Baswedan: Diselesaikan Secara Scientific, Bukan Secara Politik https://t.co/DwCk88lrKb"
1577419962565951488,https://twitter.com/tvOneNews/status/1577419962565951488,"Aremania Minta Aparat yang Menyemprot Gas Air Mata ke Tribun Stadion Kanjuruhan Mengaku, Di Dunia Bisa Kabur Tidak di Akhirat https://t.co/4jFW00csOg"
1577314136308187137,https://twitter.com/tvOneNews/status/1577314136308187137,Puan Maharani Bertemu Ketua Ketua Dewan Rakyat Inggris jelang KTT P20 https://t.co/4KDaC4CUvk
1577287939373297667,https://twitter.com/tvOneNews/status/1577287939373297667,Kompolnas: Ada Pejabat Perintahkan Anggota Gunakan Gas Air Mata https://t.co/bF1PTL9rCn
1577283705139515392,https://twitter.com/tvOneNews/status/1577283705139515392,"PDIP Marah PSI Usung Ganjar Pranowo jadi Capres, Bambang Pacul: Apa Tidak Ada Jeleknya Bicara dengan Bu Ketum Dulu? https://t.co/3EfJUPAIwJ"
1577233458405199873,https://twitter.com/tvOneNews/status/1577233458405199873,BREAKING NEWS! Arema FC Resmi Dikenakan Sanksi dari Komdis PSSI https://t.co/E5e8kVYoPB
1577226192608198656,https://twitter.com/tvOneNews/status/1577226192608198656,"ARMY BTS Indonesia Galang Dana untuk Tragedi Kanjuruhan, Terkumpul Hampir Rp500 Juta https://t.co/3uz72xGoap"
1577226171951239169,https://twitter.com/tvOneNews/status/1577226171951239169,Kompolnas Tegaskan Tak Ada Perintah Penembakan Gas Air Mata di Stadion Kanjuruhan https://t.co/vbCFKXVemw
1577205419097067521,https://twitter.com/tvOneNews/status/1577205419097067521,"NasDem Usung Anies Baswedan Jadi Capres, Puan Maharani: Fokus Dulu Tragedi Kanjuruhan https://t.co/hPcYHUkAoR"
1577103363237638144,https://twitter.com/tvOneNews/status/1577103363237638144,Perpanjangan PPKM Level 1 Seluruh Daerah Hingga 7 November https://t.co/mhkSYmPRTW
1577103349992034304,https://twitter.com/tvOneNews/status/1577103349992034304,Pengamat: Deklarasi Anies Baswedan Jadi Capres dari NasDem Picu Migrasi Pendukung Partai https://t.co/9Klu5wVOTC
1577066362190843904,https://twitter.com/tvOneNews/status/1577066362190843904,Tuntut Keadilan Aremania Ancam Bersurat ke FIFA Untuk Kirim Delegasi Lakukan Investigasi Independen Tragedi Kanjuruhan https://t.co/vOQgy9pLe1
1576997025660698629,https://twitter.com/tvOneNews/status/1576997025660698629,"Ikatan Mahasiswa Muhammadiyah Desak Kapolda Jawa Timur dan Ketua PSSI Dicopot, Ini Alasannya https://t.co/glsU1oB7yV"
1576966453034913792,https://twitter.com/tvOneNews/status/1576966453034913792,"Merinding, Ribuan Bonek Berkumpul di Tugu Pahlawan Doakan Aremania yang Gugur dalam Tragedi Kanjuruhan, Mereka Hanyut dalam Tangisan https://t.co/tyqIdh7C39"
1576960666032050177,https://twitter.com/tvOneNews/status/1576960666032050177,KPK Tak Takut Pihaknya Dianggap Memaksakan dalam Kasus Formula E https://t.co/unAcKBfztQ
1576945396076908544,https://twitter.com/tvOneNews/status/1576945396076908544,"Partai Solidaritas Indonesia akan mencalonkan Ganjar Pranowo sebagai calon presiden PSI 2024. hal ini merupakan hasil Rembuk Rakyat yang kami selenggarakan sejak akhir Februari lalu. 

Simak berita selengkapnya di https://t.co/GgtZcy4bbs
#NewsOne #CariBeritaditvOne #Ganjar #PSI https://t.co/Cpw6JxzgLl"
1576907470391611392,https://twitter.com/tvOneNews/status/1576907470391611392,PSI Dukung Pasangan Ganjar Pranowo-Yenny Wahid untuk 2024 https://t.co/FaV9RdLRSR
1576903910014738433,https://twitter.com/tvOneNews/status/1576903910014738433,33 Anak Antara Usia 4-17 Tahun Meninggal dalam Tragedi Kanjuruhan https://t.co/KPGlzvCtst
1576824916875567105,https://twitter.com/tvOneNews/status/1576824916875567105,"Deklarasi Capres Saat Duka Tragedi Kanjuruhan, Pengamat: Kurangi Rasa Empati https://t.co/EMwMKxO0qh"
1576802772913197058,https://twitter.com/tvOneNews/status/1576802772913197058,"Viral Video Prajurit TNI Siksa Suporter di Kanjuruhan, Panglima: Itu Bukan Etik Lagi, Tapi Pidana https://t.co/ltsJ8EqtTf"
1576802765887922176,https://twitter.com/tvOneNews/status/1576802765887922176,Pengamat Menilai PDIP Mulai Berhasil Naikkan Elektabilitas Puan Maharani https://t.co/1YPurN5GA0
1576791677272195073,https://twitter.com/tvOneNews/status/1576791677272195073,"Surya Paloh: Memenangkan Anies Baswedan di Pilpres 2024 Tidak Mudah, Harus Siap Hadapi Fitnah, Sirik dan Dengki https://t.co/Uf6Pd41ahu"
1576781896486637568,https://twitter.com/tvOneNews/status/1576781896486637568,"Surya Paloh: NasDem Cari Capres yang Terbaik dari yang Terbaik, Itu Ada di Sosok Anies Baswedan https://t.co/Cp5UII8Ouz"
1576781882829967362,https://twitter.com/tvOneNews/status/1576781882829967362,KPK: Tidak Ada Kepentingan Politik Pada Penanganan Kasus Formula E https://t.co/UKEzPlGLDX
1576683959794425856,https://twitter.com/tvOneNews/status/1576683959794425856,PSSI Bentuk Tim Investigasi Terkait Insiden yang Tewaskan Ratusan Suporter di Stadion Kanjuruhan Malang https://t.co/fmr9D0Xp3j
1576628844429463553,https://twitter.com/tvOneNews/status/1576628844429463553,Valentino 'Jebret' Umumkan Mundur dari Komentator BRI Liga 1 Buntut Tragedi Kanjuruhan https://t.co/NEPbGCx0PO
1576577758788222976,https://twitter.com/tvOneNews/status/1576577758788222976,Kapolri Janji Usut Tuntas Tragedi Kanjuruhan untuk Mencari Siapa yang Bertanggung Jawab https://t.co/xOWSk5Jeo2
1576574257441968131,https://twitter.com/tvOneNews/status/1576574257441968131,Korlantas Polri: STNK Tidak Sah Jika Belum Bayar Pajak dan Bisa Ditilang https://t.co/SN0Pr1TBws
1576549339929145345,https://twitter.com/tvOneNews/status/1576549339929145345,Indonesia Terancam Gagal Jadi Tuan Rumah Piala Dunia U-20 Usai Tragedi Maut Kanjuruhan https://t.co/00pmqMiZwA
1576545174205124612,https://twitter.com/tvOneNews/status/1576545174205124612,"Kapolda Jawa Timur, di Antara Ferdy Sambo dan Tragedi Berdarah Kanjuruhan https://t.co/PfzkAU2ko8"
1576537500549804032,https://twitter.com/tvOneNews/status/1576537500549804032,Indonesia Terancam Gagal Jadi Tuan Rumah Piala Dunia U-20 Seusai Terjadinya Tragedi Kanjuruhan https://t.co/PYAfCWlUWb
1576506543356653569,https://twitter.com/tvOneNews/status/1576506543356653569,PSSI Terus Komunikasi dengan FIFA demi Hindari Sanksi Pascakerusuhan di Kanjuruhan Malang https://t.co/KuEHoZX6Wo
1576487919346503680,https://twitter.com/tvOneNews/status/1576487919346503680,[BREAKING NEWS] Komnas HAM Kirim Tim Guna Investigasi Insiden Kanjuruhan https://t.co/d1P4HdFcJ6
1576474850713276416,https://twitter.com/tvOneNews/status/1576474850713276416,Kompolnas akan Turun ke Lapangan untuk Supervisi Penanganan Tragedi Kanjuruhan https://t.co/1UQCYFMWMe
1576463506521878529,https://twitter.com/tvOneNews/status/1576463506521878529,"DPR Desak Presiden Jokowi Nonaktifkan Ketua PSSI, Kapolda dan Kapolres Setempat untuk Investigasi Independen soal Tragedi Kanjuruhan https://t.co/cNkTQFdrUz"
1576455705951113219,https://twitter.com/tvOneNews/status/1576455705951113219,PSSI Tegaskan Penyebab Tragedi Kanjuruhan Bukan karena Perkelahian Antar Suporter https://t.co/ydEHukbR1q
1576437839491125250,https://twitter.com/tvOneNews/status/1576437839491125250,KONI: Suporter Sepak Bola Indonesia Harus Diedukasi https://t.co/5nLYdJ6Hyc
1576427537106104320,https://twitter.com/tvOneNews/status/1576427537106104320,"Tragedi Kanjuruhan Tewaskan Ratusan Orang, Menpora Kecewa Berat dengan Oknum Suporter Arema https://t.co/48oUtYziNH"
1576383854260400129,https://twitter.com/tvOneNews/status/1576383854260400129,"Presiden: Investigasi Tragedi Kanjuruhan, Harus Ada Yang Bertanggungjawab! https://t.co/R16kqI0lxl"
1576378195989131266,https://twitter.com/tvOneNews/status/1576378195989131266,ISESS Sesalkan Kegagalan Analisis Polisi Sebabkan Perintah Tidak Tepat Gunakan Gas Air Mata Hadapi Suporter AREMA FC https://t.co/5cY2po7qpA
1576343344271470593,https://twitter.com/tvOneNews/status/1576343344271470593,"Breaking News! Kapolda Jatim: 127 Orang Meninggal Dunia, Dua di Antaranya Anggota Polri https://t.co/DLRenedCNe"
1576326235600588800,https://twitter.com/tvOneNews/status/1576326235600588800,Lebih dari 120 Suporter Arema FC Meninggal dan Ratusan Lainnya Terluka saat Kerusuhan di Stadion Kanjuruhan https://t.co/hrzr9Nh2YF
1576318304079450113,https://twitter.com/tvOneNews/status/1576318304079450113,"Pasca Kerusuhan Stadion Kanjuruhan, PSSI Tetapkan Arema FC Dilarang Berlaga Sebagai Tuan Rumah selama Musim Liga https://t.co/nhVBb6M09g"
1576294516520554496,https://twitter.com/tvOneNews/status/1576294516520554496,"50 Kantong Jenazah Disiapkan, 3 Jenazah Suporter Arema Telah Dipulangkan ke Keluarga https://t.co/srHpLartPG"
1576077343244029952,https://twitter.com/tvOneNews/status/1576077343244029952,"Viral Sopir Truk Tidak Diperbolehkan Beli Solar, Karena Kuota di MyPertamina Miliknya Sudah Habis Padahal Belum Digunakan https://t.co/5U72Bi9UBK"
1576055568128962560,https://twitter.com/tvOneNews/status/1576055568128962560,"Najwa Shihab sedang Ada Masalah dan Mau Lapor Polisi, Nikita Mirzani Nyinyir: Kemarin Lo Hina Polisi https://t.co/iwmykuYlKQ"
1575822242998808576,https://twitter.com/tvOneNews/status/1575822242998808576,"Saksikan film spesial dengan judul ""Pengkhianatan G30SPKI""
Jumat, 30 September 2022, Pukul 20.00 WIB hanya di tvOne dan live streaming di https://t.co/pkGSggL0i8

#CariBeritaditvOne #PengkhianatanG30SPKI #G30SPKI https://t.co/QTZ7hSXDf9"
1575728260289540097,https://twitter.com/tvOneNews/status/1575728260289540097,"Tentara Pembebasan Nasional Papua Barat Organisasi Papua Merdeka (TPNPB-OPM) membantai sejumlah pekerja proyek jalan Trans-Papua Barat, Kamis (29/9/2022) petang. 

Simak berita selengkapnya di https://t.co/GgtZcy4bbs 
#NewsOne #CariBeritaditvOne #Viral https://t.co/RLwETrOgs9"
1575692304652079107,https://twitter.com/tvOneNews/status/1575692304652079107,Kelompok Separatis Papua Barat Ancam Tembak Mati Siapapun yang Mencoba Ambil Jasad Pekerja Trans-Papua Barat https://t.co/E96WiGhfHc
1575667380524572673,https://twitter.com/tvOneNews/status/1575667380524572673,"G30S PKI Dilumpuhkan Soeharto Hanya Dalam Hitungan Jam, Para Tokoh PKI Curiga Gerakan itu Memang Sengaja Dirancang Gagal https://t.co/BvUvvXg1GG"
1575562606274052096,https://twitter.com/tvOneNews/status/1575562606274052096,"'Sebagai Hamba Tuhan, Putri Candrawathi Berkata Jujur, karena Kalau Bohong Dia Berdosa', Kata Pendeta Gilbert https://t.co/h2ITp5jReX"
1575546480894832641,https://twitter.com/tvOneNews/status/1575546480894832641,Jokowi Klaim Pertumbuhan Ekonomi Indonesia Tertinggi Diantara Negara Anggota Forum G20 https://t.co/lA1NLtpihu
1575457557766086656,https://twitter.com/tvOneNews/status/1575457557766086656,"Terbawa Emosi, Rizky Billar Cekik dan Banting Lesti Kejora Hingga Menyeret Sang Istri Ke Kamar Mandi https://t.co/bkjy8eul8g"
1575321163118825472,https://twitter.com/tvOneNews/status/1575321163118825472,Kuasa Hukum Sebut Putri Candrawathi Belum Siap Ditahan dalam Kasus Pembunuhan Brigadir J https://t.co/HbM4YxwZQy
1575290305980796929,https://twitter.com/tvOneNews/status/1575290305980796929,"Sama Sekali Tak Ditanggapi Najwa Shihab, Nikita Mirzani Malah Membabi Buta Ancam Mau Bongkar 'Rahasia' Nana, Apa ? https://t.co/dEPDbmyoCE"
1575275085619138560,https://twitter.com/tvOneNews/status/1575275085619138560,"Akhirnya Terungkap, Soeharto Sama Sekali Tak Tersentuh di Tragedi G30S PKI Berkat Sembunyi di Tempat ini, Jenderal Lain Dihabisi Secara Sadis https://t.co/IxAZP7Fc3V"
1575199200417304576,https://twitter.com/tvOneNews/status/1575199200417304576,Febri Diansyah Akui Banyak Pihak Kecewa Saat Dirinya Menjadi Kuasa Hukum Ferdy Sambo dan Putri Candrawathi https://t.co/Dmm4yvmzuX
1575140280827015168,https://twitter.com/tvOneNews/status/1575140280827015168,"Kunjungi Bali, Puan Maharani Tanam Padi Bersama Petani https://t.co/eoZKCMCVIH"
1575008414677487617,https://twitter.com/tvOneNews/status/1575008414677487617,"Jika APBN Berlebih, Presiden Joko Widodo Janjikan Bakal Tambah Bansos https://t.co/Zc7G68Vdof"
1574974238297300992,https://twitter.com/tvOneNews/status/1574974238297300992,Partai NasDem Ungkap 2 Alasan Mau Capreskan Anies Baswedan di Pilpres 2024 https://t.co/uTUHDqq1HH
1574947890178695168,https://twitter.com/tvOneNews/status/1574947890178695168,Nikita Mirzani Ungkap Alasan Najwa Shihab Sampai Sekarang Masih Bungkam dan Tak Berani Melawan si Nyai https://t.co/ErQU42tJKd
1574922349488775173,https://twitter.com/tvOneNews/status/1574922349488775173,"Emosi Meledak-ledak, Nikita Mirzani Bilang Sudah 'Enek' pada Najwa Shihab, Nyai Sangat Yakin Nana sedang Panik Saat ini, Pegang Rahasia? https://t.co/OXiuFg0McG"
1574776427891007489,https://twitter.com/tvOneNews/status/1574776427891007489,Fadli Zon Komentari Revisi Syarat Penerimaan Prajurit TNI: Harusnya Dinaikkan bukan Diturunkan https://t.co/tQ7ta9Ep2q
1574701939052646401,https://twitter.com/tvOneNews/status/1574701939052646401,"Makin Garang, Nikita Mirzani Tuding Najwa Shihab Takut Alamat Check In Dibongkar, Ada Apa? https://t.co/KzmA4swl6y"
1574701925303734272,https://twitter.com/tvOneNews/status/1574701925303734272,Presiden Jokowi Tegaskan Tidak Ada Impor Aspal pada 2024 https://t.co/zU9EVLKjgW
1574612309645070336,https://twitter.com/tvOneNews/status/1574612309645070336,"Lolos Lewati Paspampres, Bocah Penjual Telur di Baubau Tawari Presiden Jokowi Barang Dagangannya https://t.co/pzL3NyeN0u"
1574605516957192192,https://twitter.com/tvOneNews/status/1574605516957192192,"Soal Pemanggilan Lukas Enembe, Jokowi: Hormati KPK, Semua Sama Dimata Hukum https://t.co/JV4ZkhmH54"
1574566766558466048,https://twitter.com/tvOneNews/status/1574566766558466048,Momen Wapres Ma'aruf Amin Jalan Pagi di Hibiya Park Tokyo https://t.co/yUs2m26WnB
1574558582817050625,https://twitter.com/tvOneNews/status/1574558582817050625,"Tantangan 'Bertepuk Sebelah Tangan', Nikita Mirzani Jadi Malu Sendiri Setelah Najwa Shihab Sama Sekali Tak Menanggapinya, Buru-buru Hapus Postingan https://t.co/YkaAchDNYP"
1574549379473514496,https://twitter.com/tvOneNews/status/1574549379473514496,"Meski telah dipecat secara tidak hormat dari institusi Polri, Ferdy Sambo disebut masih bisa kembali jadi polisi. Hal itu tertuang dalam Peraturan Kepolisian RI Nomor 7 Tahun 2022

Simak berita selengkapnya di https://t.co/GgtZcxM1Xk
#NewsOne #CariBeritaditvOne #FerdySambo https://t.co/0FphhycQcX"
1574444849021202432,https://twitter.com/tvOneNews/status/1574444849021202432,"Melecehkan Anak Tiri, Oknum Polisi di Cirebon Diamankan https://t.co/eP7UHkRbxj"
1574323180667543552,https://twitter.com/tvOneNews/status/1574323180667543552,PP Pemuda Muhammadiyah Minta Demokrat Berhenti Tebar Hoaks Jelang Pemilu https://t.co/Z95mhVIg0R
1574311589683294213,https://twitter.com/tvOneNews/status/1574311589683294213,"3 Tokoh Adu Kuat di Survei CSIS, Anies Baswedan Menang Telak! https://t.co/lhAle6VBOJ"
1574309481294757889,https://twitter.com/tvOneNews/status/1574309481294757889,Menkumham Resmikan Showroom Motor Listrik di Pekanbaru  https://t.co/xCqDpBXZfy
1574299417301385216,https://twitter.com/tvOneNews/status/1574299417301385216,"Presiden Joko Widodo (Jokowi) meminta Gubernur Papua Lukas Enembe menghormati panggilan dari Komisi Pemberantasan Korupsi (KPK) dan proses hukum. 

Simak berita selengkapnya di https://t.co/GgtZcy4bbs
#NewsOne #CariBeritaditvOne #lukasenembe https://t.co/pq9uqoZnDs"
1574256980549849088,https://twitter.com/tvOneNews/status/1574256980549849088,"Disebut Piala Konspirasi, Nikita Mirzani Menantang Najwa Shihab Untuk Melaporkannya ke Polisi: Kamu Udah Tidak Netral! https://t.co/ihhZd9gOsr"
1574113898776924160,https://twitter.com/tvOneNews/status/1574113898776924160,Kapolda Jawa Tengah Irjen Pol Ahmad Luthfi Pastikan Ledakan Bahan Petasan di Asrama Polisi Grogol Barang Sitaan 2021 https://t.co/gDbYI4lbJZ
1574068242385358849,https://twitter.com/tvOneNews/status/1574068242385358849,"Ferdy Sambo Disebut akan Menggugat Instansi Polri ke PTUN, Kuasa Hukum Buka suara https://t.co/msHeMwg3Q6"
1574046670739804161,https://twitter.com/tvOneNews/status/1574046670739804161,"BOM Meledak Di Asrama Brimob Sukoharjo
Saksikan Kabar Hari Ini bersama Yohana Gabriela pukul 22.30 WIB hanya di tvOne &amp; live streaming di https://t.co/pkGSgh23k8 
#KabarHariInitvOne #CariBeritaditvOne https://t.co/uZ3uMLrNQI"
1573993786371637248,https://twitter.com/tvOneNews/status/1573993786371637248,"Virus Dusta Itu Kan Kamu! Dinilai Konspirasi, Tak Ada Habisnya Nikita Mirzani Serang Najwa Shihab Usai Mendapatkan Penghargaan https://t.co/uSz2E8cXNV"
1573976525070041088,https://twitter.com/tvOneNews/status/1573976525070041088,"Ziarah Makam Taufiq Kiemas Bersama Cak Imin, Puan: PDIP dan PKB Sama-sama Partai Wong Cilik https://t.co/lRwSNdOQCA"
1573961286865788929,https://twitter.com/tvOneNews/status/1573961286865788929,"Anies Baswedan Melejit di Poling ILC jadi Presiden 2024, Peneliti Sebut Elektabilitas Stabil https://t.co/XnnPVbY3IX"
1573901399569858560,https://twitter.com/tvOneNews/status/1573901399569858560,"Farhat Abbas Setuju Sambo Membunuh Yosua karena Diduga Berzina, Bagaimana Sebenarnya Hukum Bagi Pezina dalam Islam? https://t.co/AsDxC9SWoV"
1573895132184649728,https://twitter.com/tvOneNews/status/1573895132184649728,"Lembaga survei Nusantara Strategic Network (NSN) mengungkapkan, mantan Ketua Umum Partai Solidaritas Indonesia (PSI), Grace Natalie masuk bursa Calon Gubernur (Cagub) DKI Jakarta.
Simak berita selengkapnya di https://t.co/gC5qsU6OZL
#NewsOne #CariBeritaditvOne https://t.co/MdR9JlarO0"
1573728607855583232,https://twitter.com/tvOneNews/status/1573728607855583232,Lembaga Survei Sebut Grace Natalie Masuk Bursa Cagub DKI https://t.co/5iNXbsWzQP
1573680949346566151,https://twitter.com/tvOneNews/status/1573680949346566151,Presiden Jokowi Akan ke Kota Baubau Berikan BSU dan BLT https://t.co/O1I7UcvtvM
1573634883972665345,https://twitter.com/tvOneNews/status/1573634883972665345,"Dihujat Netizen, Nikita Mirzani Kelabakan, Akhirnya ‘Nyai’ Hapus Postingan Soal Najwa Shihab yang Ini https://t.co/Mg98Ne6oDT"
1573587301783175168,https://twitter.com/tvOneNews/status/1573587301783175168,Anies Baswedan Menang Telak dalam Polling ILC https://t.co/1OmGMZomgf
1573534628647907328,https://twitter.com/tvOneNews/status/1573534628647907328,"Najwa Shihab berhasil membawa pulang piala dalam ajang penghargaan Indonesian Television Awards 2022, sukses meraih prestasi lewat raihan piala kategori Public Figure Inspiratif Terpopuler . 

Simak berita selengkapnya di https://t.co/H0rkdsS6AK
#NewsOne #CariBeritaditvOne https://t.co/ArWUm6Po0i"
1573523126159552513,https://twitter.com/tvOneNews/status/1573523126159552513,"Keinginan Nikita Mirzani Bertemu Najwa Shihab 'Bertepuk Sebelah Tangan', Nana Sama Sekali Tak Pedulikan Nyai, Netizen Bilang Mereka Beda Kelas https://t.co/4kNevcfKQu"
1573313756222099457,https://twitter.com/tvOneNews/status/1573313756222099457,"Demokrat Bantah Hasnaeni 'Wanita Emas' Kadernya, Jubir: Dia Kader PDIP, Ahok Garis Keras https://t.co/p9WIi5szZR"
1573296912077553666,https://twitter.com/tvOneNews/status/1573296912077553666,"Emosi 'Bertepuk Sebelah Tangan', Tantangan Nikita Mirzani Sama Sekali Tak Ditanggapi Najwa Shihab, Netizen Bilang Nyai dan Nana Beda Kelas https://t.co/eSInJge4MQ"
1573244650521264128,https://twitter.com/tvOneNews/status/1573244650521264128,"Nikita Mirzani mengancam akan membongkar keburukan Najwa Shihab. Yang terbaru Nyai menantang Nana untuk bertemu langsung dengannya. 

Simak berita selengkapnya di https://t.co/GgtZcy4bbs 
#NewsOne #CariBeritaditvOne #NikitaMirzani https://t.co/EpFrhhS1QR"
1573236553153150976,https://twitter.com/tvOneNews/status/1573236553153150976,"Viral, Benarkah Bjorka Adalah Gus Samsudin yang Menyamar Menjadi Hacker? https://t.co/SqMaJPdvpP"
1573226932397019136,https://twitter.com/tvOneNews/status/1573226932397019136,Berpindahnya ke Kompor Listrik Diklaim Menghemat APBN Sebesar 330 Miliar Rupiah per Tahun https://t.co/5TtlpSpfQr
1573211586499526657,https://twitter.com/tvOneNews/status/1573211586499526657,"Makin Panas, Nikita Mirzani Tantang Najwa Shihab, 'Dia-nya Berani Nggak Ketemu Gue...' https://t.co/eAaZejkgnS"
1573199877215252483,https://twitter.com/tvOneNews/status/1573199877215252483,Ma'ruf Amin Beberkan Alasannya jadi Wapres: Saya Disuruh Belok sama Pak Jokowi https://t.co/HbaNa2rLlV
1572995923135049729,https://twitter.com/tvOneNews/status/1572995923135049729,Lembaga Survei KedaiKOPI Nilai Puan Maharani Memiliki Rekam Jejak yang Jelas https://t.co/H3TAqpGdzY
