TweetID,TweetURL,tweet
1609324533416361984,https://twitter.com/tvOneNews/status/1609324533416361984,"Potret Memilukan Bencana Banjir di Kota Semarang, SAR Evakuasi 172 Korban https://t.co/rDwNfHekae"
1609124337977798661,https://twitter.com/tvOneNews/status/1609124337977798661,"Hingga Sabtu Sore, Banjir yang Menggenangi Stasiun Semarang Tawang Belum Surut https://t.co/rBouTuOfBV"
1608990708068929537,https://twitter.com/tvOneNews/status/1608990708068929537,Anggota Komisi IX DPR Tolak Jokowi Terbitkan Perppu Cipta Kerja: Padahal Tidak Ada yang Mendesak https://t.co/TGr7FfUVEX
1608956616539504640,https://twitter.com/tvOneNews/status/1608956616539504640,"Ibu Norma Risma Ketahuan Tak Pakai Busana di Kamar Menantu, Dia Ngeles, Alasannya Tak Masuk Akal: Ngadem Doang https://t.co/VnE5h8fSqz"
1608834938010472449,https://twitter.com/tvOneNews/status/1608834938010472449,"Diduga Gunakan Dana BAZNAS untuk Renovasi Rumah Kader PDIP, Unggahan Ganjar Pranowo Diserbu Netizen https://t.co/hUBBH7kGaw"
1608775163168059392,https://twitter.com/tvOneNews/status/1608775163168059392,PDIP Minta Jangan Dengarkan Pengakuan Hasnaeni 'Wanita Emas' https://t.co/Drl0oKWAxv
1608769884967809025,https://twitter.com/tvOneNews/status/1608769884967809025,Menteri Agama Ungkap Pegawai ASN Kemenag 40 Persen Tidak Kompeten  https://t.co/IHymMQUz2R
1608746980502831104,https://twitter.com/tvOneNews/status/1608746980502831104,"PDIP Setuju Pemilu Digelar Tertutup yang Cuman Coblos Partai, Sekjen: Irit Biaya https://t.co/ioCHZBjsfI"
1608744838538878976,https://twitter.com/tvOneNews/status/1608744838538878976,Anggaran Belanja Tidak Terduga Pemprov DKI Jakarta 2023 Naik Sebesar Rp220 Miliar  https://t.co/6CINBjjTsZ
1608630728174239744,https://twitter.com/tvOneNews/status/1608630728174239744,"Pembelaan Pihak Ferdy Sambo Bawa 35 Bukti Baru, Bongkar Kelakuan Brigadir J Sering ke Kelab Malam https://t.co/XRw149zhcp"
1608584203435913218,https://twitter.com/tvOneNews/status/1608584203435913218,Shin Tae-yong Ketar-ketir Setelah Suporter Timnas Indonesia Pecahkan Kaca Bus Pemain Thailand https://t.co/ZKvU9mlFOP
1608584169487208448,https://twitter.com/tvOneNews/status/1608584169487208448,Presiden Volodymyr Zelenskyy Mengklaim Bahwa Ukraina Mendekati Kemenangan Melawan Rusia https://t.co/1MNMg3PECe
1608419227320582144,https://twitter.com/tvOneNews/status/1608419227320582144,"Tak Terima Dipecat, Ferdy Sambo Gugat Jokowi-Kapolri https://t.co/yZpyijfeyw"
1608282545069907968,https://twitter.com/tvOneNews/status/1608282545069907968,"Cemburu? Sang Ibunda Pasang Muka Cemberut di Pernikahan Norma Risma, Ternyata Sudah Lama Berselingkuh dengan Suami Anaknya https://t.co/kw5ZQvMmFx"
1608268702486769664,https://twitter.com/tvOneNews/status/1608268702486769664,"Kapolda Papua Barat Tegas, Perintahkan Tangkap KKB dalam Keadaan Hidup atau Mati https://t.co/7Af4IB84EM"
1608251455382732802,https://twitter.com/tvOneNews/status/1608251455382732802,"Presiden Jokowi menegaskan rencana pelarangan penjualan rokok batangan bakal dituangkan dalam peraturan pemerintah pada 2023 ditempuh demi menjaga kesehatan masyarakat Indonesia.

Simak berita selengkapnya di https://t.co/Ep2k8WQTGj
#SoftNews_Sosial #NewsOne #CariBeritaditvOne https://t.co/wb7LeJE3Qb"
1607996554711031815,https://twitter.com/tvOneNews/status/1607996554711031815,"PDIP Singgung Anies Baswedan Tak Mampu Bangun Sodetan Selama Lima Tahun, Kalah dengan Heru Budi yang Baru Menjabat Dua Bulan https://t.co/pI8gtdEZLY"
1607890097869066241,https://twitter.com/tvOneNews/status/1607890097869066241,Foto-foto Kebahagiaan Norma Risma dengan Suami Sebelum Ditikung Ibu Kandung: Aa Jahat Sama Aku! https://t.co/9TBOivCOdN
1607890083407097857,https://twitter.com/tvOneNews/status/1607890083407097857,"Drama 'Mamahku Berzina dengan Suamiku', Norma Risma Hancur Hatinya, Ternyata Perselingkuhan Masih Lanjut https://t.co/aG6unuU8te"
1607830717588996096,https://twitter.com/tvOneNews/status/1607830717588996096,Aduh KPK Sebut Banyaknya OTT Tak Membuat Para Koruptor Kapok https://t.co/aNGjraV5X4
1607678454765588481,https://twitter.com/tvOneNews/status/1607678454765588481,Jokowi Tegaskan Larangan Jual Rokok Batangan demi Kesehatan https://t.co/6mTHYtk1To
1607497520980299776,https://twitter.com/tvOneNews/status/1607497520980299776,Erdogan Sebut Ronaldo Jadi Korban Politik di Piala Dunia 2022 Karena Dukung Palestina https://t.co/q3qi2mVYgD
1607311534405095424,https://twitter.com/tvOneNews/status/1607311534405095424,"Temuan 3.000 LGBT di Garut, Komisi Penanggulangan Aids: 1.004 Orang Positif HIV https://t.co/Y35b3VTLIw"
1607254266548465664,https://twitter.com/tvOneNews/status/1607254266548465664,"Ditengah Rintik Hujan, Anies baswedan Ziarah ke Makam Alm Ridwan Saidi https://t.co/HPJklliwk0"
1607194611407101952,https://twitter.com/tvOneNews/status/1607194611407101952,"Penyanyi Theresia Ebenna Ezeria Pardede atau yang akrab disapa Tere menjadi bahan perbincangan pasca viralnya sebuah video di TikTok. 

Simak berita selengkapnya di https://t.co/GeuhE7qURg
#SoftNews_Religi #NewsOne #CariBeritaditvOne #hijrah https://t.co/Y3IMgOvUzJ"
1606961862998097920,https://twitter.com/tvOneNews/status/1606961862998097920,"Ibunya Dibentak Calon Istri, Seorang Pria Asal Palembang Batalkan Pernikahan Sehari Jelang Acara https://t.co/a8idihrjAX"
1606933403815018498,https://twitter.com/tvOneNews/status/1606933403815018498,"Lama Tak Muncul Penyanyi Kondang Tere Kini Hijrah Menjadi Guru Ngaji, Ini Pesannya Untuk Para Musisi https://t.co/MZVs5f7Ttl"
1606421157099765760,https://twitter.com/tvOneNews/status/1606421157099765760,"Pendeta Saifuddin Ibrahim Bikin Video, Ngaku Heran Ada Umat Islam yang Haramkan Ucap Selamat Natal https://t.co/j6QUlNdzPR"
1606380411755855872,https://twitter.com/tvOneNews/status/1606380411755855872,Petisi Minta Final Piala Dunia 2022 Diulang Mencapai 200 Ribu Tanda Tangan https://t.co/XU8eCM3eUB
1606260236633124865,https://twitter.com/tvOneNews/status/1606260236633124865,PKS Sebut Masyarakat Akan Bertindak Jika Anies Baswedan Jadi Tersangka Dugaan Korupsi Formula E https://t.co/kGa7wkGJOx
1606229197412003840,https://twitter.com/tvOneNews/status/1606229197412003840,Survei Voxpol: Mayoritas Publik Tak Setuju Anies Baswedan Jadi Tersangka Dugaan Kasus Korupsi Formula E https://t.co/WeQj6ZbBTF
1606140190984409088,https://twitter.com/tvOneNews/status/1606140190984409088,Ahmad Riza Patria Pilih Prabowo Ketimbang Anies: Terbukti Kepemimpinannya https://t.co/njHjCfyjuy
1606077127744536578,https://twitter.com/tvOneNews/status/1606077127744536578,"Gubernur Jawa Tengah Ganjar Pranowo mendapatkan elektabilitas tertinggi dalam hasil survei Poltracking Indonesia periode 21-27 November 2022.  

Simak berita selengkapnya di https://t.co/5k6A9o2Mhf
#HardNews_Politik #NewsOne #CariBeritaditvOne #ganjarpranowo #aniesbaswedan https://t.co/jq0pLi7i4v"
1606063426002092032,https://twitter.com/tvOneNews/status/1606063426002092032,Ngaku Diperkosa tapi Tak Trauma? Ahli Heran Putri Candrawathi Masih Sudi Seatap dengan Brigadir J https://t.co/ti0dOKABfM
1605899349636321280,https://twitter.com/tvOneNews/status/1605899349636321280,Elektabilitas Ganjar Melesat Tinggi Kalahkan Anies dan Prabowo https://t.co/TPFvEt90A8
1605849008848908288,https://twitter.com/tvOneNews/status/1605849008848908288,Febri Diansyah: Tidak Pernah Ada Perencanaan Pembunuhan https://t.co/LQ5VtliSYO
1605700919592898563,https://twitter.com/tvOneNews/status/1605700919592898563,"Bantah Luhut Sebut OTT KPK Tidak Bagus, Ma'ruf Amin Tegaskan OTT Masih Diperlukan https://t.co/3fvQo4VomM"
1605655746418741248,https://twitter.com/tvOneNews/status/1605655746418741248,"Kisah Soekarno Sampai Minta-minta ke Haji Sanusi Ingin Menikahi Inggit Garnasih, Suami Inggit Pasrah https://t.co/HLK9zVgCyy"
1605444029705261056,https://twitter.com/tvOneNews/status/1605444029705261056,"Banyak Belanja Negara Tidak Produktif, Jokowi: Gedung Baru Nganggur, Dibelikan Alat Ditumpuk di Gudang https://t.co/I9hLmBpFTF"
1605004978611159041,https://twitter.com/tvOneNews/status/1605004978611159041,"Terdakwa Ferdy Sambo menduga penyidik kepolisian menginginkan semua orang yang ada di tempat kejadian perkara Duren Tiga, Jakarta Selatan, sebagai tersangka.

Simak berita selengkapnya di https://t.co/GgtZcy4bbs
#HardNews_Hukum #NewsOne #CariBeritaditvOne #BrigadirJ #FerdySambo https://t.co/o1b2eDfHEK"
1604675779010646016,https://twitter.com/tvOneNews/status/1604675779010646016,Ini Kata Ruhut Sitompul Soal Politik Identitas Anies Baswedan https://t.co/fkU5Pjae6i
1604670621715410945,https://twitter.com/tvOneNews/status/1604670621715410945,Anies Baswedan Disebut Halalkan Segala Cara Demi Raih Suara https://t.co/KM5SCKeVL9
1604524153079746561,https://twitter.com/tvOneNews/status/1604524153079746561,Kebakaran Landa Gedung Mahkamah Agung di Jalan Medan Merdeka Utara Jakarta Pusat https://t.co/D8S95HPutt
1604432301001412608,https://twitter.com/tvOneNews/status/1604432301001412608,"Hasil Survei SMRC Terbaru, NasDem Terancam Tak Lolos ke Senayan, Ini Penyebabnya https://t.co/VxZorp27Mt"
1604353403307843590,https://twitter.com/tvOneNews/status/1604353403307843590,"Soal Human Trafficking, BP2MI Sebut Kecolongan: Banyak Mafia https://t.co/UHJyhyKmsu"
1603766792794820609,https://twitter.com/tvOneNews/status/1603766792794820609,"Aksi Teatrikal di Bawaslu, Aktivis Beri Kartu Merah ke Anies Hingga Juluki Bapak Politik Identitas https://t.co/qCskgtbwvw"
1603693451262169088,https://twitter.com/tvOneNews/status/1603693451262169088,Sekjen PDIP Sebut Anies Dapat Sanksi Etis dari Bawaslu https://t.co/Cew6RNmhfU
1603679608939085835,https://twitter.com/tvOneNews/status/1603679608939085835,"Laporan Safari Politik Anies, Bawaslu: Boleh Sosialisasi Asal Bukan di Tempat Ibadah https://t.co/xNEfQVwwz5"
1603593781357318145,https://twitter.com/tvOneNews/status/1603593781357318145,"Politikus senior PDIP Ruhut Sitompul sependapat dengan meme bahwa Indonesia akan hancur jika dipimpin oleh bakal capres NasDem Anies Baswedan.

Simak berita selengkapnya di https://t.co/GgtZcxM1Xk
#HardNews_Viral #NewsOne #CariBeritaditvOne #Viral #AniesBaswedan https://t.co/W30SbRgVsX"
1603512128996249600,https://twitter.com/tvOneNews/status/1603512128996249600,"Akui KUHP Baru Tidak Sempurna, Menkumham Yasonna Laoly Minta Maaf https://t.co/dHn7l5oqCQ"
1603421016189173760,https://twitter.com/tvOneNews/status/1603421016189173760,"Ruhut Sitompul Sebut Indonesia Hancur Kalau Dipimpin Anies Baswedan, NasDem Marah Besar https://t.co/os11zsSyny"
1603359538174132224,https://twitter.com/tvOneNews/status/1603359538174132224,"Gedung C Lantai 3 Kementerian Dalam Negeri Terbakar, 8 Unit Damkar Diterjunkan https://t.co/h4J7e69MeI"
1603322788462280705,https://twitter.com/tvOneNews/status/1603322788462280705,"Penjabat (Pj) Gubernur DKI Jakarta Heru Budi Hartono mengatakan bahwa dirinya enggan ikut Pemilihan Kepala Daerah (Pilkada) 2024 sebagai Gubernur DKI Jakarta.

Simak berita selengkapnya di https://t.co/GgtZcxM1Xk
#HardNews_Politik #NewsOne #CariBeritaditvOne #Pemilu2024 https://t.co/HB3REC4Ni3"
1603012722198970369,https://twitter.com/tvOneNews/status/1603012722198970369,"Ronaldo Sumbang 1,5 juta Dolar untuk Rakyat Palestina Buka Puasa Ramadhan hingga Jual Sepatu Emas https://t.co/8c8X6vd3l9"
1602938251505172481,https://twitter.com/tvOneNews/status/1602938251505172481,Wakil Ketua DPR Sebut Omongan Bupati Meranti Tidak Pantas sebagai Pejabat https://t.co/fhey3VgdcI
1602922101228589057,https://twitter.com/tvOneNews/status/1602922101228589057,27.802 Bakal Caleg PDI Perjuangan Diminta Jangan Salah Gunakan Kekuasaan Untuk Korupsi https://t.co/FuOT3Gex6G
1602892904057700352,https://twitter.com/tvOneNews/status/1602892904057700352,"Viral Video Siswa Kesulitan Menuju ke Sekolah Karena Jalan Rusak Berlumpur, Netizen: Ironi Indonesiaku https://t.co/MQPXKsWFGS"
1602846993696854018,https://twitter.com/tvOneNews/status/1602846993696854018,"Punya Rumah dan Mobil Mewah, Harta Ferdy Sambo Hingga Kini Tidak Dapat Diklarifikasi KPK, Kenapa? https://t.co/IJgOlUKEOT"
1602682284658024448,https://twitter.com/tvOneNews/status/1602682284658024448,"Bawaslu Larang Politik Praktis di Tempat Ibadah, Cendekiawan Muda NU: Tindak Tegas! https://t.co/ujJBNfjHRU"
1602671192762388480,https://twitter.com/tvOneNews/status/1602671192762388480,"Dana CSR di Jateng Capai Rp86 Miliar, Ganjar Siap Entaskan Kemiskinan https://t.co/Sru4ld03An"
1602565621245710338,https://twitter.com/tvOneNews/status/1602565621245710338,Kronologi Teror Gerombolan Senjata Renggut Tiga Nyawa di Papua https://t.co/FYZaWE6FWm
1602438785249456128,https://twitter.com/tvOneNews/status/1602438785249456128,"""Saya Diperkosa Yosua, Dibanting Sampai Tiga Kali ke Bawah,"" kata Putri Candrawathi Sambil Menangis https://t.co/evj1l38EVB"
1602289932374245376,https://twitter.com/tvOneNews/status/1602289932374245376,Putri Candrawathi: Yosua Perkosa dan Banting Saya 3 Kali https://t.co/j8FnlRZVpY
1602255199233769473,https://twitter.com/tvOneNews/status/1602255199233769473,"Dinilai Tidak Etis, Politikus PDIP Sebut Mendagri Bisa Pecat Bupati Meranti https://t.co/P07Ros9wPz"
1602176059319123969,https://twitter.com/tvOneNews/status/1602176059319123969,Ratusan Santri Doa Bersama Dukung Ganjar Pranowo Presiden 2024 https://t.co/ohZVxAnOLZ
1602121057833349120,https://twitter.com/tvOneNews/status/1602121057833349120,"Beredar video pengakuan mantan narapidana (Napi) di media sosial twitter. Di mana pengakuan mantan narapidana itu mengecam fatwa ustadz Abdul Somad (UAS).  

Simak berita selengkapnya di https://t.co/9xOrXVHlIw
#HardNews_Viral #NewsOne #CariBeritaditvOne #ustadabdulsomad https://t.co/sXKWdGuL2N"
1602102952264892416,https://twitter.com/tvOneNews/status/1602102952264892416,"Rumah Dinas Wali Kota Blitar Dirampok, Uang Ratusan Juta dan Perhiasan Raib https://t.co/R1Hq6mb6uP"
1601897471898456065,https://twitter.com/tvOneNews/status/1601897471898456065,"Soal Bom Bunuh Diri di Polsek Astana Anyar, Mantan Napi Kecam Fatwa Ustaz Abdul Somad https://t.co/CLHC1SyF1E"
1601869914402623490,https://twitter.com/tvOneNews/status/1601869914402623490,"Kisah Yuni Shara Pura-pura Puas Saat Berhubungan Intim, Padahal Ngaku Lebih Nikmat Lakukan Sendiri https://t.co/2SuTSacT5V"
1601857588987326465,https://twitter.com/tvOneNews/status/1601857588987326465,"Tak Dapat Jatah, Erina Gudono Kecapekan di Malam Pertama, Kaesang Pangarep Malah Lakukan Hal Ini https://t.co/T1sGKtQ9VA"
1601831665013522432,https://twitter.com/tvOneNews/status/1601831665013522432,"KPK Akui Sulit Ungkap Dugaan Korupsi Formula E di Jakarta, Ini Alasannya https://t.co/nM5TSvqr0n"
1601821973088436227,https://twitter.com/tvOneNews/status/1601821973088436227,"Dianggap Mencuri Start Kampanye Pemilu, Anies Baswedan Dilaporkan ke Bawaslu https://t.co/ycZYucaEVU"
1601810653752459266,https://twitter.com/tvOneNews/status/1601810653752459266,Ketua KPK Firli Bahuri Sebut Pemberantasan Korupsi Tidak Mudah https://t.co/KlGbWgBzW7
1601508293234798592,https://twitter.com/tvOneNews/status/1601508293234798592,"Yasonna Laoly Sebut Keberagaman Indonesia Timbulkan Polemik, Penting Ada Pendidikan Toleransi https://t.co/vvsxnLbN44"
1601425105091010563,https://twitter.com/tvOneNews/status/1601425105091010563,Volodymyr Zelensky Dinobatkan Sebagai Person Of The Year 2022 https://t.co/U0DCAnJh0A
1601409375125803008,https://twitter.com/tvOneNews/status/1601409375125803008,Prabowo Beri Pangkat Letnan Koloner Tituler TNI AD kepada Deddy Corbuzier https://t.co/cLorBYTrdP
1601396283205292032,https://twitter.com/tvOneNews/status/1601396283205292032,"Media sosial dihebohkan dengan foto penghapusan nama mantan Gubernur DKI Jakarta Anies Baswedan di dinding Lapangan Ingub Klender, Jakarta Timur. 

Simak berita selengkapnya di https://t.co/ItVk0zlXZp
#HardNews_Politik #NewsOne #CariBeritaditvOne #aniesbaswedan #herubudihartono https://t.co/EBS260daDZ"
1601191736512253953,https://twitter.com/tvOneNews/status/1601191736512253953,Aktivis Minta Bawaslu dan KPU Segera Tindak Lanjuti Laporan Dugaan Curi Start Kampanye Anies Baswedan https://t.co/7hFSyDHqdL
1601182766624043008,https://twitter.com/tvOneNews/status/1601182766624043008,"Nama Anies Dicoret di Lapangan Ingub Klender, PDIP Bantah Heru Budi Sengaja Melakukan Itu https://t.co/v50w5c0VXy"
1601177348896075777,https://twitter.com/tvOneNews/status/1601177348896075777,Elite NasDem: Bamsoet Harus Vaksin Booster 10 Kali Biar Tegak Lurus pada UU https://t.co/Ge5NeQBCVo
1601080336292929536,https://twitter.com/tvOneNews/status/1601080336292929536,Sandiaga Uno: Saya Siap Maju di Pilpres 2024 Lagi https://t.co/A50MvgWqrm
1601075172311982080,https://twitter.com/tvOneNews/status/1601075172311982080,Ketua MPR Bamsoet Usul Jadwal Pemilu 2024 Dipikir Lagi https://t.co/PWXduzlrWN
1601033899345383428,https://twitter.com/tvOneNews/status/1601033899345383428,"Calon presiden usungan Partai Nasdem Anies Baswedan dilaporkan ke polisi oleh Aliansi Pemuda Cinta Demokrasi (APCD). Bahkan berkas laporan disebut sudah lengkap. 

Simak berita selengkapnya di https://t.co/GgtZcy3DlU
#HardNews_Politik #NewsOne #CariBeritaditvOne #AniesBaswedan https://t.co/4MZN3rhHbe"
1600873232391090176,https://twitter.com/tvOneNews/status/1600873232391090176,Hasil Survei Poltracking: Tingkat Kepercayaan Publik Terhadap Pemerintah Joko Widodo dan Ma'ruf Amin Tinggi https://t.co/neQY41GJPa
1600715081884794880,https://twitter.com/tvOneNews/status/1600715081884794880,"Gedung Kemenkumham Kebakaran, Penyebab Belum Diketahui  https://t.co/9aISkVMhKu"
1600709143366578177,https://twitter.com/tvOneNews/status/1600709143366578177,"Koordinator Aliansi Pemuda Cinta Demokrasi. Husni Jabal menyatakan pihaknya telah melengkapi bukti berkas laporannya terhadap Anies Baswedan dan NasDem ke Bawaslu. 

Simak berita selengkapnya di https://t.co/NALucwy4jx
#HardNews_Politik #NewsOne #CariBeritaditvOne #aniesbaswedan https://t.co/Y0GJrN3TXD"
1600698075408117760,https://twitter.com/tvOneNews/status/1600698075408117760,Geger! Ferdy Sambo Ngaku Spontan Bunuh Brigadir J dan Tidak Terencana: Saya Sudah Emosi https://t.co/CQuQI4m5RX
1600584714330705920,https://twitter.com/tvOneNews/status/1600584714330705920,"Meningkatnya Intensitas Politik Jelang Pemilu 2024, Sebanyak 32 Komunitas Lakukan Ikrar Tetap Setia Kepada Jokowi https://t.co/AuJtVzBIEY"
1600567962045644802,https://twitter.com/tvOneNews/status/1600567962045644802,"Gawat, Aliansi Pemuda Cinta Demokrasi Lengkapi Berkas Laporan Anies ke Bawaslu Minta Segera Diurus Laporannya https://t.co/O2IaJZXz8A"
1600516758976487429,https://twitter.com/tvOneNews/status/1600516758976487429,NasDem: Anies Tidak Pernah Kampanye di Tempat Ibadah https://t.co/aa75ForLLJ
1600504541480648705,https://twitter.com/tvOneNews/status/1600504541480648705,Bawaslu Diminta Tindaklanjuti Laporan Dugaan Curi Start Kampanye Anies Baswedan dan NasDem https://t.co/CtLMaB4k8f
1600400769723027456,https://twitter.com/tvOneNews/status/1600400769723027456,"“KUHP Hukum Kafir, Perangi Penegak Hukum Setan QS 9:29,” Tulisan di Motor Biru di Lokasi Bom Bunuh Diri Astanaanyar https://t.co/26GCelTbST"
1600329005827522560,https://twitter.com/tvOneNews/status/1600329005827522560,Pimpinan DPR dan Menkumham Persilahkan Gugat ke MK jika Tidak Setujui RUU KUHP https://t.co/STeopSvxEG
1600306866479067138,https://twitter.com/tvOneNews/status/1600306866479067138,"Innalillahi, Lord Rangga Mantan Petinggi Sunda Empire Tutup Usia https://t.co/RHZZijwMCv"
1600190219617472512,https://twitter.com/tvOneNews/status/1600190219617472512,"Bharada E Harus Dipecat, Ferdy Sambo: Dia yang Menembak, Bukan Cuman Saya! https://t.co/Y8p1aYIpAc"
1600128960138207233,https://twitter.com/tvOneNews/status/1600128960138207233,"Anies dan NasDem Dilaporkan ke Bawaslu dan KPU, Ini Alasannya https://t.co/Jop81iH02H"
1600101156126347264,https://twitter.com/tvOneNews/status/1600101156126347264,Gerindra Tolak Ajakan PKS Gabung ke Koalisi Perubahan https://t.co/9NLEEEPfDj
1600099324159197184,https://twitter.com/tvOneNews/status/1600099324159197184,"Anies Pakai Jet Pribadi saat Safari Politik, NasDem: Kalau Kendaraan Dinas Justru Bermasalah https://t.co/U20bI5BEIs"
1600092690116247552,https://twitter.com/tvOneNews/status/1600092690116247552,"Balita perempuan berinisial G usia 2,8 tahun tewas mengenaskan usai dibanting bertubi-tubi oleh pria berinsial YA di Apartemen Kalibata City, Pancoran, Jakarta Selatan.

Simak berita selengkapnya di https://t.co/GgtZcxM1Xk
#HardNews_Viral #NewsOne #CariBeritaditvOne #Kalibata https://t.co/UfAu6P0aM5"
1600059737340407808,https://twitter.com/tvOneNews/status/1600059737340407808,"Menteri Hukum dan HAM, Yasonna Laoly memberikan tanggapan atas sikap Anggota Fraksi PKS Iskan Qalba Lubis yang walk out saat pengesahan RKUHP di Rapat Paripurna DPR.

Simak berita selengkapnya di https://t.co/GgtZcxM1Xk
#HardNews_Hukum  #NewsOne #CariBeritaditvOne #PKS #RUUKUHP https://t.co/xKi0xcVudm"
1600053202640318464,https://twitter.com/tvOneNews/status/1600053202640318464,Aktivis Gerakan Tolak Pemilu Curang Minta Anies dan NasDem Taati Aturan Pemilu https://t.co/cP6qvi4yvK
1599830101474279424,https://twitter.com/tvOneNews/status/1599830101474279424,Wow! Air Siraman Kaesang Diambil dari Tujuh Sumber Mata Air di Solo https://t.co/vFWmf0NwEl
1599727174084628483,https://twitter.com/tvOneNews/status/1599727174084628483,"Jelang Natal dan Tahun Baru, Kepala BNPT Himbau Masyarakat Tenang dan Waspada terhadap Ancaman Teror https://t.co/vJsb8Ika5O"
1599713224425107456,https://twitter.com/tvOneNews/status/1599713224425107456,"Buntut Pencopotan Marullah Matali Sebagai Sekda DKI Buat Warga Betawi Geram, Pengamat: Heru Ugal-ugalan https://t.co/eKrgdZpjlJ"
1599696968208764929,https://twitter.com/tvOneNews/status/1599696968208764929,"Kepulauan Widi, Maluku Utara Dilelang Situs Asing, Menteri Luhut : Hoax https://t.co/PzCsC3aAil"
1599658464397385729,https://twitter.com/tvOneNews/status/1599658464397385729,"Copot Jabatan Marullah Matali Sebagai Sekda DKI, Forkabi Nilai Pj Gubernur Heru Budi Tak Beretika https://t.co/PzR3mMK6FA"
1599640730187726848,https://twitter.com/tvOneNews/status/1599640730187726848,"Viral Anies Baswedan Naik Jet Pribadi Mewah saat Safari Politik, Ini Kata NasDem https://t.co/vGJTZ6wUXp"
1599631791643840512,https://twitter.com/tvOneNews/status/1599631791643840512,Anggota Komisi V DPR Tolak Wacana Luhut Hapus KA Argo Parahyangan https://t.co/CRftvA3las
1599416385121439746,https://twitter.com/tvOneNews/status/1599416385121439746,"Pakar Nilai Jokowi Nyaman Berada di Tengah Relawannya: Tak Dapat Kritik Tajam, Hanya Jilatan Pendukung https://t.co/bBQjLTleVs"
1599405927043825670,https://twitter.com/tvOneNews/status/1599405927043825670,"Jokowi Disebut Tengah Gundah Jelang 2024, Pengamat: Dia Kehilangan Zona Nyaman https://t.co/yK7wFS21gb"
1599377620281749505,https://twitter.com/tvOneNews/status/1599377620281749505,"Bangun 4 Masjid, Erick Thohir Dinilai Berkomitmen Terhadap Umat Islam https://t.co/1TWVZmvhak"
1599358112355737600,https://twitter.com/tvOneNews/status/1599358112355737600,Pakar Hukum Nilai Jokowi Tidak Etis Sebut Ciri-ciri Pemimpin dari Warna Rambut: Ini Negara Demokrasi https://t.co/K9KWeKs8wB
1599292826571124738,https://twitter.com/tvOneNews/status/1599292826571124738,Kementerian Pendidikan Palestina Imbau Sekolah-Sekolah Putar Lagu Indonesia Raya dan Kibarkan Bendera Merah Putih https://t.co/JXv1l8zDjO
1599268518767517698,https://twitter.com/tvOneNews/status/1599268518767517698,Terduga Pelaku Penganiayaan Imam Masjid di Bekasi Alami Gangguan Kejiwaan https://t.co/h2ORwAaYm4
1599242866559455233,https://twitter.com/tvOneNews/status/1599242866559455233,Ketua Umum PPP dan PAN Terang-terangan Usung Ganjar Sebagai Capres https://t.co/WQZmhpWodL
1599037258782605313,https://twitter.com/tvOneNews/status/1599037258782605313,"Kapolri Sebut Masih Cari Keberadaan Ismail Bolong, IPW Nilai Disembunyikan Agar Tak Membokar Kasus di Polri https://t.co/v76SdW2gbf"
1599005786373763072,https://twitter.com/tvOneNews/status/1599005786373763072,"Pendakwah Indonesia, Kang Rashied Meninggal Dunia, Pembicara Damai Indonesiaku tvOne, Ini Profilnya https://t.co/HVktKnl5VE"
1598981399448784902,https://twitter.com/tvOneNews/status/1598981399448784902,Kinerja Menteri BUMN Erick Thohir Dinilai Sukses di Berbagai Bidang https://t.co/lnnss4ZozD
1598859569773436934,https://twitter.com/tvOneNews/status/1598859569773436934,"Kementerian Luar Negeri menyatakan belum menerima konfirmasi mengenai rencana kunjungan Utusan Khusus Amerika Serikat untuk Memajukan Hak LGBTQI+ Jessica Stern ke Indonesia.

Simak berita selengkapnya di https://t.co/fNcItqIVoK
#HardNews_Viral #NewsOne #CariBeritaditvOne #viral https://t.co/RwIK9D3foW"
1598844750731579393,https://twitter.com/tvOneNews/status/1598844750731579393,"Siapkan Blue Print BUMN 25 Tahun, Erick Thohir Panen Dukungan https://t.co/mYgSvMtOPw"
1598641142051966977,https://twitter.com/tvOneNews/status/1598641142051966977,"Ketua Umum Partai Amanat Nasional (PAN) Zulkifli Hasan menampung  aspirasi dari DPW PAN Jawa Tengah (Jateng) untuk mencalonkan Ganjar Pranowo sebagai Capres 2024

Simak berita selengkapnya di https://t.co/9nzwJxnifO
#HardNews_Politik #NewsOne #CariBeritaditvOne #ganjarpranowo https://t.co/O56iUo2nNM"
1598619746865655808,https://twitter.com/tvOneNews/status/1598619746865655808,"Unggul di Semua Survei, Zulhas: Ganjar Bisa Dicalonkan Capres PAN 2024 https://t.co/l2lEmEEuvW"
1598528537216307200,https://twitter.com/tvOneNews/status/1598528537216307200,Presiden Jokowi Ingatkan 2024 Menentukan Masa Depan Bangsa dan Negara https://t.co/nXQOBaD027
1598372874376871936,https://twitter.com/tvOneNews/status/1598372874376871936,Wow! Densus 88 Temukan Buku Kecil di Kamar Terduga Teroris Asal Sukoharjo https://t.co/GinLqfSQvo
